num,name,price,type,star,sold,from,img_src,url,id
108,Mega We Care Fish Oil 1000 mg 30'S/100'S สารพัดประโยชน์,99.0,ร้านแนะนำ,4.8758,2400.0,จังหวัดกรุงเทพมหานคร,https://cf.shopee.co.th/file/4acd1c5dd50067f3b80c881aed59f81d_tn,https://shopee.co.th//Mega-We-Care-Fish-Oil-1000-mg-30'S-100'S-สารพัดประโยชน์-i.74243435.1237574810,1237574810
109,Orijen Six Fish สูตรปลา 6 ชนิด แมวอายุ 1-6 ปี 5.4 kg.,1799.0,ร้านแนะนำ,4.9444,301.0,จังหวัดปทุมธานี,https://cf.shopee.co.th/file/225deb8616db3b6a1d592e4b182ac977_tn,https://shopee.co.th//Orijen-Six-Fish-สูตรปลา-6-ชนิด-แมวอายุ-1-6-ปี-5.4-kg.-i.69310189.6236651739,6236651739
110,VISTRA Odorless Fish Oil 1000mg 100 capsules,220.0,ร้านแนะนำ,4.9621,538.0,จังหวัดกรุงเทพมหานคร,https://cf.shopee.co.th/file/67b4587ec2c8d33659e6a7c49b8f739a_tn,https://shopee.co.th//VISTRA-Odorless-Fish-Oil-1000mg-100-capsules-i.40933267.6217262588,6217262588
111,Digital Automatic Fish Feeder Aquarium Tank (AF-2009D) เครื่องให้อาหารปลา อุปกรณ์เลี้ยงปลา เครื่องให้อาหารอัตโนมัติ,310.0,general,4.7502,2200.0,จังหวัดกรุงเทพมหานคร,https://cf.shopee.co.th/file/de594213e9959717c6fdb925de6ea0df_tn,https://shopee.co.th//Digital-Automatic-Fish-Feeder-Aquarium-Tank-(AF-2009D)-เครื่องให้อาหารปลา-อุปกรณ์เลี้ยงปลา-เครื่องให้อาหารอัตโนมัติ-i.156065172.2365234551,2365234551
112,Fish Cap By Anne Jakrajutatip ผลิตภัณฑ์เสริมอาหารตราฟิช แคป โดยคุณแอน จักรพงษ์,790.0,general,4.7736,552.0,จังหวัดนครปฐม,https://cf.shopee.co.th/file/4c7b885d8c7f3096bcf8333bd4d894aa_tn,https://shopee.co.th//Fish-Cap-By-Anne-Jakrajutatip-ผลิตภัณฑ์เสริมอาหารตราฟิช-แคป-โดยคุณแอน-จักรพงษ์-i.257138922.7456152722,7456152722
113,VISTRA FISH OIL HI-DHA 500 mg. 30 แคปซูล,283.0,ร้านแนะนำ,5.0,59.0,จังหวัดจันทบุรี,https://cf.shopee.co.th/file/f7fb23258dc3c2fe0993e7f860643d19_tn,https://shopee.co.th//VISTRA-FISH-OIL-HI-DHA-500-mg.-30-แคปซูล-i.27273240.2815030663,2815030663
114,Mega We Care Fish Oil 1000 mg 30 เม็ด (14530),99.0,ร้านแนะนำ,4.8474,3500.0,จังหวัดกระบี่,https://cf.shopee.co.th/file/261aaa6c9208ad979f6f434f1793a960_tn,https://shopee.co.th//Mega-We-Care-Fish-Oil-1000-mg-30-เม็ด-(14530)-i.26952523.342690269,342690269
115,[MANOON] ORIJEN SIX FISH DOG 340g โอริเจน สูตร ปลา 6 ชนิด สำหรับสุนัข 340 กรัม,210.0,general,4.9545,55.0,จังหวัดกรุงเทพมหานคร,https://cf.shopee.co.th/file/ea48a3d25e70e5a8783deabdcb050309_tn,https://shopee.co.th//-MANOON-ORIJEN-SIX-FISH-DOG-340g-โอริเจน-สูตร-ปลา-6-ชนิด-สำหรับสุนัข-340-กรัม-i.87766216.7612483755,7612483755
116,สุดคุ้ม! 60/150 เม็ด มี Omega 3 เท่า Blackmores Omega Triple Super Strength Fish Oil นำ้มันปลา โอเมก้า บำรุงสมอง fishoil,690.0,general,4.9391,783.0,จังหวัดกรุงเทพมหานคร,https://cf.shopee.co.th/file/2a7b0dce27aa933922331a40699da4e5_tn,https://shopee.co.th//สุดคุ้ม!-60-150-เม็ด-มี-Omega-3-เท่า-Blackmores-Omega-Triple-Super-Strength-Fish-Oil-นำ้มันปลา-โอเมก้า-บำรุงสมอง-fishoil-i.15786923.4613874612,4613874612
117,น้ำมันปลาโอเมก้า / OMEGA Fish Oil 100 Softgels Brain Health Digestion Heart Eye Muscletech,348.0,ร้านแนะนำ,5.0,17.0,จังหวัดกรุงเทพมหานคร,https://cf.shopee.co.th/file/258f57d6655d658c02e0ab7e7d6f6eea_tn,https://shopee.co.th//น้ำมันปลาโอเมก้า-OMEGA-Fish-Oil-100-Softgels-Brain-Health-Digestion-Heart-Eye-Muscletech-i.132956398.8415355155,8415355155
118,Fish Oil 1000 mg บรรจุ 90 แคปซูล,621.0,general,0.0,no sold,จังหวัดสุรินทร์,https://cf.shopee.co.th/file/6a6f3b35125c5b7654256859976d05f7_tn,https://shopee.co.th//Fish-Oil-1000-mg-บรรจุ-90-แคปซูล-i.145891737.5550897170,5550897170
119,[30 Softgel] Fish Oil OMEGA-3 1000 mg น้ำมันปลาสูตรเข้มข้นค่า Omega 3 สูง บำรุงสมอง สายตา หัวใจ,75.0,general,4.8619,892.0,จังหวัดกรุงเทพมหานคร,https://cf.shopee.co.th/file/a1cc12b2353e873126d2d4f4bdad8ade_tn,https://shopee.co.th//-30-Softgel-Fish-Oil-OMEGA-3-1000-mg-น้ำมันปลาสูตรเข้มข้นค่า-Omega-3-สูง-บำรุงสมอง-สายตา-หัวใจ-i.91596967.7565780572,7565780572
120,Magenta 26 กล่อง 10 ซอง อาหารเสริมสำหรับผู้หญิง,194.0,general,4.85,760.0,จังหวัดกรุงเทพมหานคร,https://cf.shopee.co.th/file/94b5c62d3f1c20bd4856b42635ecc98c_tn,https://shopee.co.th//Magenta-26-กล่อง-10-ซอง-อาหารเสริมสำหรับผู้หญิง-i.377286682.3578188953,3578188953
121,น้ำมันปลา​MEGA​ FISH​ OIL1000mg. 200เม็ด​+30เม็ด,782.0,general,0.0,no sold,จังหวัดหนองคาย,https://cf.shopee.co.th/file/450f43b36dc71c44756826e17b8cab0d_tn,https://shopee.co.th//น้ำมันปลา​MEGA​-FISH​-OIL1000mg.-200เม็ด​-30เม็ด-i.69147942.5660948902,5660948902
122,☀️ส่งฟรี☀️ น้ำมันปลา Fish oil กิฟฟารีน น้ำมันตับปลา+กิฟฟารีน 500 1000 มก. ยาบำรุงสมอง ยาบำรุงข้อเข่าเสื่อมอักเสบ,200.0,general,4.9474,44.0,จังหวัดนครราชสีมา,https://cf.shopee.co.th/file/8e4b6f9c02c3ec232a170d9cb6effa51_tn,https://shopee.co.th//☀️ส่งฟรี☀️-น้ำมันปลา-Fish-oil-กิฟฟารีน-น้ำมันตับปลา-กิฟฟารีน-500-1000-มก.-ยาบำรุงสมอง-ยาบำรุงข้อเข่าเสื่อมอักเสบ-i.293014793.3256995293,3256995293
123,Blackmores vitamin cold relife  Bio C 1000mg   Chewable Tablets 150 Capsules ออสเตรเลีย วิตามินซี เม็ดเคี้ยว,389.0,ร้านแนะนำ,4.8555,4900.0,จังหวัดนครราชสีมา,https://cf.shopee.co.th/file/c62c3f6e3926ddd3a8a180b6ce61f5b4_tn,https://shopee.co.th//Blackmores-vitamin-cold-relife-Bio-C-1000mg-Chewable-Tablets-150-Capsules-ออสเตรเลีย-วิตามินซี-เม็ดเคี้ยว-i.310535134.7454968745,7454968745
124,"กิฟฟารีน น้ำมันปลา 4 เอ็กซ์ (Fish Oil) (ขนาด 1,000 มก. บรรจุ 30 แคปซูล) ดีเอชเอ(DHA) อีพีเอ(EPA) ฟรีค่าจัดส่ง",620.0,general,0.0,no sold,จังหวัดพิษณุโลก,https://cf.shopee.co.th/file/5499230f56f08aa537fe1c6de207dbad_tn,https://shopee.co.th//กิฟฟารีน-น้ำมันปลา-4-เอ็กซ์-(Fish-Oil)-(ขนาด-1-000-มก.-บรรจุ-30-แคปซูล)-ดีเอชเอ(DHA)-อีพีเอ(EPA)-ฟรีค่าจัดส่ง-i.435175910.4187953304,4187953304
125,น้ำมันปลา 4 เอ็กซ์ FISH OIL 4X บำรุงสมอง ลดคอเลสเตอรอล หลอดเลือดอุดตัน ลดการอักเสบและบวมของข้อ,620.0,general,0.0,no sold,จังหวัดปทุมธานี,https://cf.shopee.co.th/file/d9fd410e99ec926141f2993bf5a05561_tn,https://shopee.co.th//น้ำมันปลา-4-เอ็กซ์-FISH-OIL-4X-บำรุงสมอง-ลดคอเลสเตอรอล-หลอดเลือดอุดตัน-ลดการอักเสบและบวมของข้อ-i.115406004.6179138283,6179138283
126,คันชิงหลิว BLACK K FISH ความแข็งระดับ 8H,649.0,ร้านแนะนำ,5.0,10.0,จังหวัดร้อยเอ็ด,https://cf.shopee.co.th/file/4e9857ca30c5e02a8bed6005272886f9_tn,https://shopee.co.th//คันชิงหลิว-BLACK-K-FISH-ความแข็งระดับ-8H-i.170526578.7385120346,7385120346
127,Mega We Care Fish Oil 1000 mg 30และ100 เม็ด (1ขวด),99.0,general,4.8333,78.0,จังหวัดตรัง,https://cf.shopee.co.th/file/1d5259184955dd0fe5f98fc06157804c_tn,https://shopee.co.th//Mega-We-Care-Fish-Oil-1000-mg-30และ100-เม็ด-(1ขวด)-i.201413904.5207842450,5207842450
128,ไส้กรอกปลากาฬสินธุ์ Smoked Fish  Sausage,95.0,general,5.0,18.0,จังหวัดนนทบุรี,https://cf.shopee.co.th/file/7301f7499f40cab85cee9a360c115edf_tn,https://shopee.co.th//ไส้กรอกปลากาฬสินธุ์-Smoked-Fish-Sausage-i.452487681.10007153542,10007153542
129,Sun Fish Crispy หนังปลาแซลมอนทอดกรอบ,45.0,general,4.9048,100.0,จังหวัดสมุทรปราการ,https://cf.shopee.co.th/file/b77730913186eea040f5ef6e07df0c36_tn,https://shopee.co.th//Sun-Fish-Crispy-หนังปลาแซลมอนทอดกรอบ-i.437843583.8052061416,8052061416
130,พร้อมส่ง กล่องโดมเลี้ยงสัตว์แบบพกพา 🐠Elton Insect & Fish viewer 🐛,390.0,general,4.9,18.0,จังหวัดกระบี่,https://cf.shopee.co.th/file/9d6e05b02ce045a6997e28f66b2bd329_tn,https://shopee.co.th//พร้อมส่ง-กล่องโดมเลี้ยงสัตว์แบบพกพา-🐠Elton-Insect-Fish-viewer-🐛-i.22037244.4172823470,4172823470
131,❗พร้อมส่ง❗สนับกันกระแทก As Fish Premium รุ่นสีสันสดใส,450.0,general,0.0,2.0,จังหวัดบุรีรัมย์,https://cf.shopee.co.th/file/b9431f02fd47efaebd3e1f2dddfbb1dd_tn,https://shopee.co.th//❗พร้อมส่ง❗สนับกันกระแทก-As-Fish-Premium-รุ่นสีสันสดใส-i.55282986.8736416452,8736416452
132,Blackmores Fish Oil 1000 Mg. (80 เม็ด) บำรุงสมอง,330.0,ร้านแนะนำ,5.0,5.0,จังหวัดกระบี่,https://cf.shopee.co.th/file/a7817f89a76e01c89245e807b79b2538_tn,https://shopee.co.th//Blackmores-Fish-Oil-1000-Mg.-(80-เม็ด)-บำรุงสมอง-i.35413424.1034977302,1034977302
133,FISH UPON THE SKY CLIP | คลิปหนีบปลาบนฟ้าคลิปหนีบปลาบนฟ้า ของใช้ประจำตัวของ “ปี”,390.0,general,4.8462,43.0,จังหวัดราชบุรี,https://cf.shopee.co.th/file/449e3c12a66be4470435eca4f60f724e_tn,https://shopee.co.th//FISH-UPON-THE-SKY-CLIP-คลิปหนีบปลาบนฟ้าคลิปหนีบปลาบนฟ้า-ของใช้ประจำตัวของ-“ปี”-i.21662982.9751035399,9751035399
134,Healthy Care Triple Strength Fish Oil 1500 mg 150 Capsules EPA 600mg DHA300mg exp11/2023,799.0,ร้านแนะนำ,4.8462,38.0,จังหวัดปทุมธานี,https://cf.shopee.co.th/file/6a7c2f20dd57e12f3968e99d2b55173c_tn,https://shopee.co.th//Healthy-Care-Triple-Strength-Fish-Oil-1500-mg-150-Capsules-EPA-600mg-DHA300mg-exp11-2023-i.26398369.11804142975,11804142975
135,1ขวด one bottle Nature Made® Fish Oil 1200mg 200 Sofs,650.0,ร้านแนะนำ,4.9443,850.0,จังหวัดชลบุรี,https://cf.shopee.co.th/file/a5c7597850833d6b327fdc7ff0d13317_tn,https://shopee.co.th//1ขวด-one-bottle-Nature-Made®-Fish-Oil-1200mg-200-Sofs-i.501635.1019182952,1019182952
136,Strong Gold Fish 120 ml.(มัลติวิตามินรวม สำหรับปลาทอง เร่งสี เสริมโครงสร้าง ป้องกันโรค ช่วยเจริญอาหาร),70.0,ร้านแนะนำ,4.9189,654.0,จังหวัดสมุทรปราการ,https://cf.shopee.co.th/file/7dd4f9ca74b5f567746b46833f25c5e0_tn,https://shopee.co.th//Strong-Gold-Fish-120-ml.(มัลติวิตามินรวม-สำหรับปลาทอง-เร่งสี-เสริมโครงสร้าง-ป้องกันโรค-ช่วยเจริญอาหาร)-i.107851162.1847699583,1847699583
137,"Fish Cap By Anne Jakrajutatip ซื้อ 2 ชิ้นราคา 1,199 บาท",1199.0,general,4.9,61.0,จังหวัดนครปฐม,https://cf.shopee.co.th/file/0d3d91e68750b26695bd7610a546c207_tn,https://shopee.co.th//Fish-Cap-By-Anne-Jakrajutatip-ซื้อ-2-ชิ้นราคา-1-199-บาท-i.257138922.7372733263,7372733263
138,สินค้าราคาพิเศษ [Exp10/21] Vistra Tuna Fish Oil Hi-DHA 500 Mg บำรุงสมอง เสริมความจำ (ฟรี Salmon Fish oil 7's 3ซอง),195.0,ร้านแนะนำ,5.0,2.0,จังหวัดอุบลราชธานี,https://cf.shopee.co.th/file/e5fd07f3b183642d483f4ddffcf68d9f_tn,https://shopee.co.th//สินค้าราคาพิเศษ-Exp10-21-Vistra-Tuna-Fish-Oil-Hi-DHA-500-Mg-บำรุงสมอง-เสริมความจำ-(ฟรี-Salmon-Fish-oil-7's-3ซอง)-i.129545893.9466529281,9466529281
139,🔥🔥Exp.11/2023 Kirkland Fish Oil 400 เม็ด,798.0,ร้านแนะนำ,4.84,112.0,จังหวัดกรุงเทพมหานคร,https://cf.shopee.co.th/file/c16069aa5698f447176b4d977fe0eb67_tn,https://shopee.co.th//🔥🔥Exp.11-2023-Kirkland-Fish-Oil-400-เม็ด-i.502296.3964176400,3964176400
140,🐟🐟กระดูกปลาป่นแท้ Fish bone meal🐟🐟,25.0,general,5.0,27.0,จังหวัดสมุทรปราการ,https://cf.shopee.co.th/file/f12c4777dc8abf28d3bc7286c59bdd7d_tn,https://shopee.co.th//🐟🐟กระดูกปลาป่นแท้-Fish-bone-meal🐟🐟-i.94911143.7100747491,7100747491
141,Felina Canino  แมว Black & White Fish & Fowl Deep Sea Treasure Ocean Ensemble Roos & Moos 101 Fish อาหารแมว กระป๋อง,35.0,ร้านแนะนำ,4.8416,9700.0,จังหวัดกรุงเทพมหานคร,https://cf.shopee.co.th/file/94dfab518b22a83c967503b90793500d_tn,https://shopee.co.th//Felina-Canino-แมว-Black-White-Fish-Fowl-Deep-Sea-Treasure-Ocean-Ensemble-Roos-Moos-101-Fish-อาหารแมว-กระป๋อง-i.56717998.6304930568,6304930568
142,ไส้กรอก Fish Fit สูตร KETO ไส้กรอกคีโต,76.0,general,4.6923,1300.0,จังหวัดกรุงเทพมหานคร,https://cf.shopee.co.th/file/044eec00c68d016a2bffb17014b65c02_tn,https://shopee.co.th//ไส้กรอก-Fish-Fit-สูตร-KETO-ไส้กรอกคีโต-i.7886714.6462442921,6462442921
143,Vistra  Fish Oil  Salmon1000mg/Odorless1000mg/hi-dha 500mg,102.0,ร้านแนะนำ,4.9091,41.0,จังหวัดนครสวรรค์,https://cf.shopee.co.th/file/5732bda1975a43019afb13b5dde777a6_tn,https://shopee.co.th//Vistra-Fish-Oil-Salmon1000mg-Odorless1000mg-hi-dha-500mg-i.140758906.5355225909,5355225909
144,DHA BRAIN SUPPORT Fish Oil Kiddy Kids น้ำมันปลาแซลมอน ขนาด60แคปซูล,530.0,general,4.9333,42.0,จังหวัดกรุงเทพมหานคร,https://cf.shopee.co.th/file/c885f248897ecad2615da278ebc3a37a_tn,https://shopee.co.th//DHA-BRAIN-SUPPORT-Fish-Oil-Kiddy-Kids-น้ำมันปลาแซลมอน-ขนาด60แคปซูล-i.28685569.8744906990,8744906990
145,Mega fish oil 100 capsules 2 ขวด แถม Eugeca ยาอม 2 แผง,310.0,general,4.9146,523.0,จังหวัดกรุงเทพมหานคร,https://cf.shopee.co.th/file/cb28992983ec405776b07ecbc6d3aec3_tn,https://shopee.co.th//Mega-fish-oil-100-capsules-2-ขวด-แถม-Eugeca-ยาอม-2-แผง-i.3341541.1250112547,1250112547
146,"🔥🔥 Exp.11/22 Kirkland Wild Alaskan Fish Oil 1,400 mg 230 เม็ด",1280.0,ร้านแนะนำ,4.8889,31.0,จังหวัดกรุงเทพมหานคร,https://cf.shopee.co.th/file/91dacc1ad9359db439e7fc74cec4e796_tn,https://shopee.co.th//🔥🔥-Exp.11-22-Kirkland-Wild-Alaskan-Fish-Oil-1-400-mg-230-เม็ด-i.17969668.10206074654,10206074654
147,(** ราคาโปร **) Mega Wecare Fish oil 100's,299.0,ร้านแนะนำ,5.0,77.0,จังหวัดสุราษฎร์ธานี,https://cf.shopee.co.th/file/d2beef9ae4b1db3381e96e6b586cd114_tn,https://shopee.co.th//(**-ราคาโปร-**)-Mega-Wecare-Fish-oil-100's-i.19908345.211223593,211223593
148,#สินค้าพร้อมส่ง#Swisse Ultiboost Odourless High Strength Wild Fish Oil 1500mg 400 Capsules,809.0,general,5.0,122.0,จังหวัดกำแพงเพชร,https://cf.shopee.co.th/file/841b9e44d87a5df4441a86f96533ee2d_tn,https://shopee.co.th//-สินค้าพร้อมส่ง-Swisse-Ultiboost-Odourless-High-Strength-Wild-Fish-Oil-1500mg-400-Capsules-i.234967741.6819266219,6819266219
149,อาหารกุ้ง King Fish Shrimp&Bottom Feed 60g คิงฟิช - neotop,59.0,general,4.8372,151.0,จังหวัดกรุงเทพมหานคร,https://cf.shopee.co.th/file/241d299cd66411364b7b087090336e14_tn,https://shopee.co.th//อาหารกุ้ง-King-Fish-Shrimp-Bottom-Feed-60g-คิงฟิช-neotop-i.127502578.2064587801,2064587801
150,พร้อมส่ง!! แท้ 100%  IRVINS SALTED EGG FISH SKIN / Potato,249.0,ร้านแนะนำ,4.619,422.0,จังหวัดกรุงเทพมหานคร,https://cf.shopee.co.th/file/987b71a7abaf948156da2b6f353250e1_tn,https://shopee.co.th//พร้อมส่ง!!-แท้-100-IRVINS-SALTED-EGG-FISH-SKIN-Potato-i.23586150.1976088240,1976088240
151,Kirkland Wild Alaskan Fish Oil 1400mg 230Softgels,1090.0,general,0.0,4.0,จังหวัดกรุงเทพมหานคร,https://cf.shopee.co.th/file/e1c12c28d0ba44710786da65ebda852f_tn,https://shopee.co.th//Kirkland-Wild-Alaskan-Fish-Oil-1400mg-230Softgels-i.144445560.3878047564,3878047564
152,ไส้กรอกปลาแซลมอน คีโต...Fish Fit มี 3 รส อร่อย!!!,35.0,general,4.7255,240.0,จังหวัดนนทบุรี,https://cf.shopee.co.th/file/fb5dd9390e619ee4920842e6965e4d35_tn,https://shopee.co.th//ไส้กรอกปลาแซลมอน-คีโต...Fish-Fit-มี-3-รส-อร่อย!!!-i.229482507.3971825669,3971825669
153,Mullard Tropical Fish Guitar Capacitors,75.0,general,4.88,161.0,จังหวัดอุบลราชธานี,https://cf.shopee.co.th/file/9dc6136f0ad16eabff5322d6bfa61421_tn,https://shopee.co.th//Mullard-Tropical-Fish-Guitar-Capacitors-i.117669.1245085433,1245085433
154,ปลา King fish แอ็กชั่นสวย เคลื่อนตัวอย่างอิสระ เหมือนมีชีวิตจริง  เหยื่อปลอม ปลาบั้ง,59.0,ร้านแนะนำ,4.6522,66.0,จังหวัดระยอง,https://cf.shopee.co.th/file/e6402d803a6f2b3debbea7a5b0a5fe5a_tn,https://shopee.co.th//ปลา-King-fish-แอ็กชั่นสวย-เคลื่อนตัวอย่างอิสระ-เหมือนมีชีวิตจริง-เหยื่อปลอม-ปลาบั้ง-i.28361299.2277795640,2277795640
155,Blackmores Fish Oil 500mg Mini Caps 400 caps  (Odourless),831.0,general,4.7843,142.0,ฮ่องกง,https://cf.shopee.co.th/file/26bc3ef270a2cfb0f7e338d45bcb8aeb_tn,https://shopee.co.th//Blackmores-Fish-Oil-500mg-Mini-Caps-400-caps-(Odourless)-i.98768576.1896954810,1896954810
156,❤️พร้อมส่งค่ะ❤️ Swisse Ultiboost Odourless High Strength Wild Fish Oil 1500 mg.,799.0,general,4.9903,233.0,จังหวัดกรุงเทพมหานคร,https://cf.shopee.co.th/file/5dfd8ac5693cbe2e426cf76880dc1962_tn,https://shopee.co.th//❤️พร้อมส่งค่ะ❤️-Swisse-Ultiboost-Odourless-High-Strength-Wild-Fish-Oil-1500-mg.-i.104572516.3336467869,3336467869
157,Vistra fish oil น้ำมันตับปลา 1000 มก. บำรุงสมอง ผสมวินตามิน E (20เม็ด),150.0,general,4.8462,45.0,จังหวัดศรีสะเกษ,https://cf.shopee.co.th/file/14ca7eed3e276ae18d432a9b62c72fe8_tn,https://shopee.co.th//Vistra-fish-oil-น้ำมันตับปลา-1000-มก.-บำรุงสมอง-ผสมวินตามิน-E-(20เม็ด)-i.169642953.5850360169,5850360169
158,ที่คีบปลา ลอยน้ำได้ แบบพกพา WEEBASS FLOATING FISH GRIP,80.0,ร้านแนะนำ,4.8519,43.0,จังหวัดลพบุรี,https://cf.shopee.co.th/file/1dbebc4baeebbc011ed2e56fac3491c1_tn,https://shopee.co.th//ที่คีบปลา-ลอยน้ำได้-แบบพกพา-WEEBASS-FLOATING-FISH-GRIP-i.75084745.7963679904,7963679904
159,พร้อมส่งทุกรสชาติ!! แท้ 100% IRVINS SALTED EGG FISH SKIN หนังปลาทอดคลุกไข่เค็ม (ส่งจากกรุงเทพ),249.0,general,4.8438,141.0,จังหวัดกรุงเทพมหานคร,https://cf.shopee.co.th/file/72be0c696b8c3bd05f62485befaabba7_tn,https://shopee.co.th//พร้อมส่งทุกรสชาติ!!-แท้-100-IRVINS-SALTED-EGG-FISH-SKIN-หนังปลาทอดคลุกไข่เค็ม-(ส่งจากกรุงเทพ)-i.71972451.1942913196,1942913196
160,"Vistra Fish oil 1000 mg. 45 , 75 cap",199.0,ร้านแนะนำ,4.6154,32.0,จังหวัดกรุงเทพมหานคร,https://cf.shopee.co.th/file/0e922ce3a6f9c5282617bfbdfa0cbbba_tn,https://shopee.co.th//Vistra-Fish-oil-1000-mg.-45-75-cap-i.48076996.1255561647,1255561647
161,FISH OIL By Mega We Care,189.0,general,4.8,9.0,จังหวัดพิษณุโลก,https://cf.shopee.co.th/file/2fbc33777cf01ab5968dc8ad9786f057_tn,https://shopee.co.th//FISH-OIL-By-Mega-We-Care-i.43774111.4079549549,4079549549
162,POPO MURUKU IKAN FISH MURUKU มี30ห่อเล็ก,79.0,ร้านแนะนำ,5.0,63.0,จังหวัดนราธิวาส,https://cf.shopee.co.th/file/e5fbfb889a4a1e6ea6e8b89ee8eee51c_tn,https://shopee.co.th//POPO-MURUKU-IKAN-FISH-MURUKU-มี30ห่อเล็ก-i.72347767.7466479980,7466479980
163,[Alaska King] ปลาจินดาระ / ปลาแบล็คค็อดอลาสก้า แช่แข็ง Alaska Black Cod (Sable Fish) by Alaska King,225.0,general,5.0,305.0,จังหวัดสมุทรสาคร,https://cf.shopee.co.th/file/c74a6f2e1273b27cce50c1388a3ee635_tn,https://shopee.co.th//-Alaska-King-ปลาจินดาระ-ปลาแบล็คค็อดอลาสก้า-แช่แข็ง-Alaska-Black-Cod-(Sable-Fish)-by-Alaska-King-i.372422428.7076033328,7076033328
164,เหยื่อปลอมปลายาง JOKER FISH (WEEBASS),100.0,general,4.875,31.0,จังหวัดชลบุรี,https://cf.shopee.co.th/file/6ef7c203e12f90546f517e788e898e22_tn,https://shopee.co.th//เหยื่อปลอมปลายาง-JOKER-FISH-(WEEBASS)-i.261468797.4841644341,4841644341
165,Kirkland Fish Oil 1000 Mg. 400 SOFTGELS   พร้อมส่ง!!,672.0,general,4.9399,934.0,จังหวัดกรุงเทพมหานคร,https://cf.shopee.co.th/file/0b331cb001c6d480d7310f75aeed9ad8_tn,https://shopee.co.th//Kirkland-Fish-Oil-1000-Mg.-400-SOFTGELS-พร้อมส่ง!!-i.151330344.2285312240,2285312240
166,Active-1 Cat Chicken&Fish (15kg) [1ออเดอร์x1กระสอบ] Exp:03/2022 Promotion,890.0,general,4.9289,724.0,จังหวัดกรุงเทพมหานคร,https://cf.shopee.co.th/file/4a42d9f0fb05d07d678caecbea0ca89a_tn,https://shopee.co.th//Active-1-Cat-Chicken-Fish-(15kg)-1ออเดอร์x1กระสอบ-Exp-03-2022-Promotion-i.22009981.1394867337,1394867337
