num,id,name,price,rating,review,img_src,url,rank
1,B002KW3OVS,Art 101 173-Piece Wood Art Set,30.52,4.7,330,https://m.media-amazon.com/images/I/91dc5sKc-BL._AC_UL320_.jpg,https://www.amazon.com//gp/slredirect/picassoRedirect.html/ref=pa_sp_atf_aps_sr_pg1_1?ie=UTF8&adId=A08082771H4OEFCDI57M&url=%2FArt-101-173-Piece-Wood-Set%2Fdp%2FB002KW3OVS%2Fref%3Dsr_1_1_sspa%3Fdchild%3D1%26keywords%3Dwood%26qid%3D1625202410%26sr%3D8-1-spons%26psc%3D1&qualifier=1625202410&id=8428380279192587&widgetName=sp_atf,not be a best
2,B07T1361KK,"50Pcs Unfinished Wood Pieces 4x4 Inch Square Blank Wooden,Wooden Cutouts for Crafts,Squares Cutout Tiles Unfinished Wood Cup Coasters Natural Slices Wooden Square Cutouts for Ornaments HomeDecoration",12.49,4.6,995,https://m.media-amazon.com/images/I/81nzCMq9zbL._AC_UL320_.jpg,https://www.amazon.com//Unfinished-Coasters-Christmas-Ornaments-HomeDecoration/dp/B07T1361KK/ref=sr_1_2?dchild=1&keywords=wood&qid=1625202410&sr=8-2,not be a best
3,B0834LT7T2,"Unfinished Birch Wood Canvas Panels Kit, Falling in Art 4 Pack of 9x12’’ Studio 3/4’’ Deep Cradle Boards for Pouring Art, Crafts, Painting and More",out of stock,4.7,313,https://m.media-amazon.com/images/I/71LaSWxCIWL._AC_UL320_.jpg,https://www.amazon.com//Falling-Art-Studio-Painting-Panels/dp/B0834LT7T2/ref=sr_1_3?dchild=1&keywords=wood&qid=1625202410&sr=8-3,Best Seller
4,B001KVM89O,The Wood,2.99,4.8,"2,946",https://m.media-amazon.com/images/I/71vrLrtbPtL._AC_UL320_.jpg,https://www.amazon.com//Wood-Elayn-Taylor/dp/B001KVM89O/ref=sr_1_4?dchild=1&keywords=wood&qid=1625202410&sr=8-4,not be a best
5,B08HS42B89,"Natural Wood Slices 60 Pcs 2.5~3 Inches, Flasoo Unfinished Wood Craft Kit Predrilled with Hole Wooden Circles Tree Slices with Bark for DIY Arts Crafts, Rustic Wedding Decoration, Christmas Ornaments",16.99,4.1,62,https://m.media-amazon.com/images/I/81+gvhrrdKL._AC_UL320_.jpg,https://www.amazon.com//Flasoo-Unfinished-Predrilled-Decoration-Christmas/dp/B08HS42B89/ref=sr_1_5?dchild=1&keywords=wood&qid=1625202410&sr=8-5,not be a best
6,B01M1GSS48,"Walnut Hollow Value Pack Medium Basswood Country Plank for Wood Burning, Home Décor and Rustic Weddings, (6 Pack)",56.66,4.8,523,https://m.media-amazon.com/images/I/81OOFSNR32L._AC_UL320_.jpg,https://www.amazon.com//Walnut-Hollow-Basswood-Country-Weddings/dp/B01M1GSS48/ref=sr_1_6?dchild=1&keywords=wood&qid=1625202410&sr=8-6,not be a best
7,B08CK2GLJ6,"Unfinished Wood Slices Large Wood Slices for Crafts, Wood Centerpieces for Tables Wood Slabs",23.99,4.6,343,https://m.media-amazon.com/images/I/41+DNkgcPhL._AC_UL320_.jpg,https://www.amazon.com//Slices-Crafts-Centerpieces-Tables-Wedding/dp/B08CK2GLJ6/ref=sr_1_7?dchild=1&keywords=wood&qid=1625202410&sr=8-7,not be a best
8,B07LGTL8WR,"Meetory 42 Piece Unfinished Blank Wood Square,3 Different Size Wood Square Slices Cutouts for DIY Arts Craft Project, Pyrography Art, Painting Writing and Decoration(10cm,8cm,5cm)",12.67,4.4,"1,405",https://m.media-amazon.com/images/I/614bMQevnrL._AC_UL320_.jpg,https://www.amazon.com//Meetory-Unfinished-Different-Pyrography-Decoration/dp/B07LGTL8WR/ref=sr_1_8?dchild=1&keywords=wood&qid=1625202410&sr=8-8,not be a best
9,B07R4YLDHH,"Unfinished Wood Squares for Crafts, 1 Inch Thick (6x6 in, 4 Pack)",14.99,4.5,336,https://m.media-amazon.com/images/I/61TZwPPbXGS._AC_UL320_.jpg,https://www.amazon.com//Bright-Creations-Unfinished-Square-Blocks/dp/B07R4YLDHH/ref=sr_1_9?dchild=1&keywords=wood&qid=1625202410&sr=8-9,not be a best
10,B07P6D1VXP,"5 Pack Round Rustic Woods Slices, 9""-12"", Unfinished Wood, Great for Weddings Centerpieces, Crafts",39.99,4.4,365,https://m.media-amazon.com/images/I/81yu-cyt13L._AC_UL320_.jpg,https://www.amazon.com//Rustic-Slices-Unfinished-Weddings-Centerpieces/dp/B07P6D1VXP/ref=sr_1_10?dchild=1&keywords=wood&qid=1625202410&sr=8-10,not be a best
11,B08T61PRV9,"Wood Circles for Crafts , 12Pcs 12 Inch Unfinished Blank Wood Rounds Slice , with 78.7Inch Ribbon & Twine for DIY Crafts , Painting , Carving , Sign , Door Hanger , Christmas Decor",15.99,4.4,104,https://m.media-amazon.com/images/I/71zVSNKioCS._AC_UL320_.jpg,https://www.amazon.com//Circles-Unfinished-78-7Inch-Painting-Christmas/dp/B08T61PRV9/ref=sr_1_11?dchild=1&keywords=wood&qid=1625202410&sr=8-11,not be a best
12,B088TG3ZJM,Ruisita 60 Pieces 6 x 4 Inch Rectangle Unfinished Wood Pieces Blank Sharp Corners for DIY Hand-Made Project and Home Decor,17.99,4.5,192,https://m.media-amazon.com/images/I/81g+JC1YTrL._AC_UL320_.jpg,https://www.amazon.com//Ruisita-Rectangle-Unfinished-Corners-Hand-Made/dp/B088TG3ZJM/ref=sr_1_12?dchild=1&keywords=wood&qid=1625202410&sr=8-12,not be a best
13,B08RDZ3PDF,300pcs 20mm Wooden Beads Natural Unfinished Round Wood Loose Beads Wood Spacer Beads for Craft Making Decorations and DIY Crafts,10.39,4.8,59,https://m.media-amazon.com/images/I/71Jzbgx09IL._AC_UL320_.jpg,https://www.amazon.com//300pcs-Wooden-Natural-Unfinished-Decorations/dp/B08RDZ3PDF/ref=sr_1_13?dchild=1&keywords=wood&qid=1625202410&sr=8-13,not be a best
14,B091BXSKDV,FEZZIA Natural Wood Slices 10-12 inches 5Pcs Unfinished Oval Shaped Wooden Slices with Rope for Street Sign Billboard Decorations Painting DIY Crafts Christmas Wedding Ornaments,18.99,4.3,13,https://m.media-amazon.com/images/I/71c4fhXylwL._AC_UL320_.jpg,https://www.amazon.com//FEZZIA-Unfinished-Billboard-Decorations-Christmas/dp/B091BXSKDV/ref=sr_1_14?dchild=1&keywords=wood&qid=1625202410&sr=8-14,not be a best
15,B08P1753GJ,"ADXCO 8 Pack Wood Panels 12 x 8 inch Wooden Canvas Board Unfinished Wooden Panel Boards for Painting, Arts, Pouring Use with Oils, Acrylics",23.99,4.3,40,https://m.media-amazon.com/images/I/717l6vyC+0L._AC_UL320_.jpg,https://www.amazon.com//ADXCO-Unfinished-Painting-Pouring-Acrylics/dp/B08P1753GJ/ref=sr_1_15?dchild=1&keywords=wood&qid=1625202410&sr=8-15,not be a best
16,B07RFW1VYJ,The Wood,out of stock,4.8,"2,946",https://m.media-amazon.com/images/I/71MO46kOdFL._AC_UL320_.jpg,https://www.amazon.com//Wood-Elayn-Taylor/dp/B07RFW1VYJ/ref=sr_1_16?dchild=1&keywords=wood&qid=1625202410&sr=8-16,not be a best
17,B097HMX4NN,"Hammont Wooden Rustic Nested Tray - 5 Pack - Set of Rectangular Shape Wood Trays for Crafts with Cut Out Handles | Kitchen Nesting Trays for Serving Pastries, Snacks, Mini Bars, Chocolate",19.99,4.4,"2,368",https://m.media-amazon.com/images/I/81DI+Sfi8LS._AC_UL320_.jpg,https://www.amazon.com//Hammont-Wooden-Rustic-Nested-Tray/dp/B097HMX4NN/ref=sr_1_17?dchild=1&keywords=wood&qid=1625202410&sr=8-17,not be a best
18,B01K27PX0C,Triumph Sports All Wood 2x4 Cornhole Bean Bag Toss Sets - Boards and Bags Included,out of stock,4.4,297,https://m.media-amazon.com/images/I/812tihvAs5L._AC_UL320_.jpg,https://www.amazon.com//Triumph-Woodie-Tournament-Cornhole-All-Wood/dp/B01K27PX0C/ref=sr_1_18?dchild=1&keywords=wood&qid=1625202410&sr=8-18,not be a best
19,B08TTPTBF6,"Wood Burning Kit, Wood Burning Tool with 2 Adjustable Temperature Wood Burning Pen and Accessories, DIY Wood Burning Set for Embossing, Carving and Soldering, Popular Gifts for Adults and Kids",29.99,4.1,13,https://m.media-amazon.com/images/I/81qcQWoLXrS._AC_UL320_.jpg,https://www.amazon.com//Adjustable-Temperature-Accessories-Embossing-Soldering/dp/B08TTPTBF6/ref=sr_1_19?dchild=1&keywords=wood&qid=1625202410&sr=8-19,not be a best
20,B08QCS88HN,"Wood Burning Kit,Wood Burning Tool,Wood Burner Tool,Wood Burning Tips,Pyrography Kit,Wood-Burning Kits Adults Beginners Pen",42.99,4.5,120,https://m.media-amazon.com/images/I/81SxjMvdp7L._AC_UL320_.jpg,https://www.amazon.com//Burning-Burner-Pyrography-Wood-Burning-Beginners/dp/B08QCS88HN/ref=sr_1_20?dchild=1&keywords=wood&qid=1625202410&sr=8-20,not be a best
21,B0922M7HYQ,"10 Pack 12 Inch Unfinished Wood Circles with 24 Acrylic Paints,3 Paint Brushes,3 Stencil,Ribbon & Twine for Crafts,Painting,Welcome Sign for Front Porch,Holiday Decor,Unfinished Blank Wooden Circle",32.9,no rating,no review,https://m.media-amazon.com/images/I/81vDBn13NQS._AC_UL320_.jpg,https://www.amazon.com//Unfinished-Circles-Acrylic-Brushes-Painting/dp/B0922M7HYQ/ref=sr_1_21?dchild=1&keywords=wood&qid=1625202410&sr=8-21,not be a best
22,B08L62VSH1,"Unfinished Wood, 15 Pack Wood Sheets, Balsa Wood Thin Craft Wood Board for House Aircraft Ship Boat Arts and Crafts, School Projects, Wooden DIY Ornaments (150x100x2mm)",12.99,4.3,393,https://m.media-amazon.com/images/I/61Uvvht21ZL._AC_UL320_.jpg,https://www.amazon.com//Unfinished-Aircraft-Projects-Ornaments-150x100x2mm/dp/B08L62VSH1/ref=sr_1_22?dchild=1&keywords=wood&qid=1625202410&sr=8-22,not be a best
23,B000Q9J0R4,The Woods: A Suspense Thriller,8.99,4.6,"6,443",https://m.media-amazon.com/images/I/8180kWHFA3L._AC_UL320_.jpg,https://www.amazon.com//Woods-Suspense-Thriller-Harlan-Coben-ebook/dp/B000Q9J0R4/ref=sr_1_23?dchild=1&keywords=wood&qid=1625202410&sr=8-23,not be a best
24,B08P1QJXTR,"ADXCO 8 Pack Wood Panels 12 x 12 Inch Unfinished Wood Canvas Wooden Panel Boards for Painting, Pouring, Arts Use with Oils, Acrylics",30.99,4.2,94,https://m.media-amazon.com/images/I/71O7-WVYB+L._AC_UL320_.jpg,https://www.amazon.com//ADXCO-Unfinished-Painting-Pouring-Acrylics/dp/B08P1QJXTR/ref=sr_1_24?dchild=1&keywords=wood&qid=1625202410&sr=8-24,not be a best
25,B07WGMGG2D,FOGAWA Balsa Wood Sheets 1/16 ×8×12 Inch Unpainted Thin Plywood Wood Sheets Baltic Birch Plywood for Cricut Maker Mini House Airplane Ship Boat DIY Model (5 Pcs),out of stock,4.2,506,https://m.media-amazon.com/images/I/51gt5EHh0BL._AC_UL320_.jpg,https://www.amazon.com//FOGAWA-300x200x1-5mm-Unfinished-Unpainted-Basswood/dp/B07WGMGG2D/ref=sr_1_25?dchild=1&keywords=wood&qid=1625202410&sr=8-25,not be a best
26,B08L62VSH1,"Unfinished Wood, 15 Pack Wood Sheets, Balsa Wood Thin Craft Wood Board for House Aircraft Ship Boat Arts and Crafts, School Projects, Wooden DIY Ornaments (150x100x2mm)",12.99,4.3,393,https://m.media-amazon.com/images/I/61Uvvht21ZL._AC_UL320_.jpg,https://www.amazon.com//gp/slredirect/picassoRedirect.html/ref=pa_sp_mtf_aps_sr_pg1_1?ie=UTF8&adId=A058351513HZLSAW8NY4L&url=%2FUnfinished-Aircraft-Projects-Ornaments-150x100x2mm%2Fdp%2FB08L62VSH1%2Fref%3Dsr_1_26_sspa%3Fdchild%3D1%26keywords%3Dwood%26qid%3D1625202410%26sr%3D8-26-spons%26psc%3D1&qualifier=1625202410&id=8428380279192587&widgetName=sp_mtf,not be a best
27,B094RBHCY3,DOLOMITE Wood Burning Kit with Accessories Adjustable Temperature for Adults and Beginners Professional Pyrography Pen with Soldering Iron Creative Tool DIY for Stamping/Embossing/Carving/Soldering,28.99,no rating,no review,https://m.media-amazon.com/images/I/71EmFI9rrQS._AC_UL320_.jpg,https://www.amazon.com//gp/slredirect/picassoRedirect.html/ref=pa_sp_mtf_aps_sr_pg1_1?ie=UTF8&adId=A02130388AUB8JPDCXFV&url=%2FDOLOMITE-Wood-Burning-Set%2Fdp%2FB094RBHCY3%2Fref%3Dsr_1_27_sspa%3Fdchild%3D1%26keywords%3Dwood%26qid%3D1625202410%26sr%3D8-27-spons%26psc%3D1&qualifier=1625202410&id=8428380279192587&widgetName=sp_mtf,not be a best
28,B07ZHVCY2Y,"Bright Creations Unfinished Hanging Wood Sign (16 in, 2-Pack)",7.99,4.4,95,https://m.media-amazon.com/images/I/51goKL3fmOL._AC_UL320_.jpg,https://www.amazon.com//gp/slredirect/picassoRedirect.html/ref=pa_sp_mtf_aps_sr_pg1_1?ie=UTF8&adId=A06463922KLAT2V7C2RWY&url=%2FBright-Creations-Unfinished-String-Rectangle%2Fdp%2FB07ZHVCY2Y%2Fref%3Dsr_1_28_sspa%3Fdchild%3D1%26keywords%3Dwood%26qid%3D1625202410%26sr%3D8-28-spons%26psc%3D1&qualifier=1625202410&id=8428380279192587&widgetName=sp_mtf,not be a best
29,B07FZM1GKQ,Unfinished Natural Wood Slices 12 Pcs 3.5-4 inch Craft Wood kit Circles Crafts Christmas Ornaments DIY Crafts with Bark for Crafts Rustic Wedding Decoration by William Craft (3.5-4inch),12.98,4.5,"2,445",https://m.media-amazon.com/images/I/71YPhNCN52L._AC_UL320_.jpg,https://www.amazon.com//Unfinished-Craft-Christmas-Ornaments-William/dp/B07FZM1GKQ/ref=sr_1_29?dchild=1&keywords=wood&qid=1625202410&sr=8-29,not be a best
30,B07PN78R3M,The Woods,0.99,3.4,4,https://m.media-amazon.com/images/I/71qn0diVjaL._AC_UL320_.jpg,https://www.amazon.com//Woods-Kristen-DeGree/dp/B07PN78R3M/ref=sr_1_30?dchild=1&keywords=wood&qid=1625202410&sr=8-30,not be a best
31,B08YYG8846,"Unfinished Birch Wood Canvas Panels Kit, Falling in Art 4 Pack of 2 Sizes 11x14' and 9x12' Studio 3/4’’ Deep Cradle Boards for Pouring Art, Crafts, Painting, and More",out of stock,4.6,12,https://m.media-amazon.com/images/I/71+Rxm+XM+L._AC_UL320_.jpg,https://www.amazon.com//Unfinished-Falling-Art-Pouring-Painting/dp/B08YYG8846/ref=sr_1_31?dchild=1&keywords=wood&qid=1625202410&sr=8-31,not be a best
32,B07JMVQN5K,"Baltic Birch Plywood, 3 mm 1/8 x 6 x 12 Inch Craft Wood, Box of 8 B/BB Grade Baltic Birch Sheets, Perfect for Laser, CNC Cutting and Wood Burning, by Woodpeckers",17.99,4.5,"3,232",https://m.media-amazon.com/images/I/51Nh8mmE89L._AC_UL320_.jpg,https://www.amazon.com//Premium-Plywood-Perfect-Cutting-Burning/dp/B07JMVQN5K/ref=sr_1_32?dchild=1&keywords=wood&qid=1625202410&sr=8-32,Best Seller
33,B081TK9QLS,"Arteza Natural Wood Slices, 25 Pieces, 3.5-4 Inch Diameter, 0.4 Inch Thickness, Round Wood Discs for Crafts, Centerpieces & Paintings, Sanded & Polished Circles",20.99,4.7,782,https://m.media-amazon.com/images/I/81pvmwi8Q3L._AC_UL320_.jpg,https://www.amazon.com//Diameter-Thickness-Centerpieces-Paintings-Polished/dp/B081TK9QLS/ref=sr_1_33?dchild=1&keywords=wood&qid=1625202410&sr=8-33,not be a best
34,B07XYP29VL,YoleShy 6 Pcs 8'' x 8'' Unfinished Wood Cradled Painting Panel Boards for Arts & Craft - Wooden Canvas Panels,16.99,4.6,"1,012",https://m.media-amazon.com/images/I/61oiFDMhAES._AC_UL320_.jpg,https://www.amazon.com//YoleShy-Unfinished-Cradled-Painting-Boards/dp/B07XYP29VL/ref=sr_1_34?dchild=1&keywords=wood&qid=1625202410&sr=8-34,not be a best
35,B08XYW6KXJ,"Wood Burning Kit,109 Pcs Professional Wood Burning Tool with Adjustable Temperature 392°F~932°F Wood Burning Pen for woodburning Embossing Carving Soldering",39.99,4.4,25,https://m.media-amazon.com/images/I/81yXa6T21OS._AC_UL320_.jpg,https://www.amazon.com//Professional-Adjustable-Temperature-392%C2%B0F-932%C2%B0F-woodburning/dp/B08XYW6KXJ/ref=sr_1_35?dchild=1&keywords=wood&qid=1625202410&sr=8-35,not be a best
36,B07D7M9L5W,"Rustic Weathered Reclaimed Wood Planks for DIY Crafts, Projects and Decor (6 Planks - 24"" Long)",23.99,4.5,548,https://m.media-amazon.com/images/I/91Vx-TC3BtL._AC_UL320_.jpg,https://www.amazon.com//Rustic-Weathered-Reclaimed-Wood-Projects/dp/B07D7M9L5W/ref=sr_1_36?dchild=1&keywords=wood&qid=1625202410&sr=8-36,not be a best
37,B074VMD5NB,"ClosetMaid 1419 Premium Wood Ventilated Shelf Kit, 6-Foot X 16-Inch, Espresso",out of stock,4.6,192,https://m.media-amazon.com/images/I/71KngWmuKmL._AC_UL320_.jpg,https://www.amazon.com//ClosetMaid-1419-Premium-Ventilated-Espresso/dp/B074VMD5NB/ref=sr_1_37?dchild=1&keywords=wood&qid=1625202410&sr=8-37,not be a best
38,B08RYJ8X5B,"FUMONCHY Wood Burning Kit 126Pcs, Wood Burning Tool with Soldering Iron Tips, Wood Burner Temperature Adjustable with On-Off Switch, Pyrography Pen with Wood Burning Stencils for Embossing Carving",38.99,4.5,80,https://m.media-amazon.com/images/I/813u6O3oqKL._AC_UL320_.jpg,https://www.amazon.com//FUMONCHY-Soldering-Temperature-Adjustable-Pyrography/dp/B08RYJ8X5B/ref=sr_1_38?dchild=1&keywords=wood&qid=1625202410&sr=8-38,not be a best
39,B08VJ1SSLK,"Profey Headcover for Golf Clubs, Golf Club Driver Head Covers Protective Golf Club Cover for Driver Wood(460cc)",24.99,no rating,no review,https://m.media-amazon.com/images/I/71QtdcMAlnL._AC_UL320_.jpg,https://www.amazon.com//Profey-Headcover-Driver-Covers-Protective/dp/B08VJ1SSLK/ref=sr_1_39?dchild=1&keywords=wood&qid=1625202410&sr=8-39,not be a best
40,B077YDZ725,"Sun Joe CJ603E 15-Amp 1.7-Inch Cutting Diameter Electric Silent Wood Chipper/Shredder, green",162.0,4.2,"1,623",https://m.media-amazon.com/images/I/71zwO9-3pML._AC_UL320_.jpg,https://www.amazon.com//Sun-Joe-CJ603E-1-7-Inch-Diameter/dp/B077YDZ725/ref=sr_1_40?dchild=1&keywords=wood&qid=1625202410&sr=8-40,not be a best
41,B07QSH1T32,Unfinished Natural Wood Slices 20 Pcs 3.5-4 inch Craft Wood kit Circles Crafts Christmas Ornaments Rustic Wedding Decoration DIY Crafts with Bark for Crafts,14.98,4.5,"1,928",https://m.media-amazon.com/images/I/81HS1zODssL._AC_UL320_.jpg,https://www.amazon.com//Unfinished-Craft-Christmas-Ornaments-William/dp/B07QSH1T32/ref=sr_1_41?dchild=1&keywords=wood&qid=1625202410&sr=8-41,not be a best
42,B001N7X1UA,"Elmer's Products, Inc E7000 Carpenters Wood Glue, 4 Fl oz",2.48,4.7,"5,022",https://m.media-amazon.com/images/I/61rEuaVrUCL._AC_UL320_.jpg,https://www.amazon.com//Elmers-Products-E7000-Carpenters-Multicolor/dp/B001N7X1UA/ref=sr_1_42?dchild=1&keywords=wood&qid=1625202410&sr=8-42,not be a best
43,B08J1LCDHT,"Gorilla Ultimate Waterproof Wood Glue, 8 ounce, Natural, (Pack of 1)",5.47,4.7,"1,730",https://m.media-amazon.com/images/I/71-Wu4O+JVL._AC_UL320_.jpg,https://www.amazon.com//Gorilla-Ultimate-Waterproof-1-Pack-Natural/dp/B08J1LCDHT/ref=sr_1_43?dchild=1&keywords=wood&qid=1625202410&sr=8-43,Best Seller
44,B08FSS1VKT,"10 Pack Basswood Sheet, 1/16 X 8 X 12 Inch Thin Plywood Wood Sheets for Crafts",19.99,4.6,215,https://m.media-amazon.com/images/I/81kBKOVmiuL._AC_UL320_.jpg,https://www.amazon.com//Basswood-Sheet-Plywood-Sheets-Crafts/dp/B08FSS1VKT/ref=sr_1_44?dchild=1&keywords=wood&qid=1625202410&sr=8-44,not be a best
45,B07LGKHW5R,"Gorilla 6206005 Wood Glue, 36 ounce Bottle, Natural Wood Color, (Pack of 1)",10.99,4.7,"4,397",https://m.media-amazon.com/images/I/81FicxshfML._AC_UL320_.jpg,https://www.amazon.com//Gorilla-6206005-36oz-Natural-Color/dp/B07LGKHW5R/ref=sr_1_45?dchild=1&keywords=wood&qid=1625202410&sr=8-45,not be a best
46,B08GXZY2J6,"12 Pieces 12 Inch Wood Circles for Crafts - Unfinished Blank Wooden Circle, Wood Slices for Painting, Home, Party, Holiday Decor",20.88,4.5,"1,036",https://m.media-amazon.com/images/I/71Wy26AqREL._AC_UL320_.jpg,https://www.amazon.com//Pieces-Inch-Wood-Circles-Crafts/dp/B08GXZY2J6/ref=sr_1_46?dchild=1&keywords=wood&qid=1625202410&sr=8-46,not be a best
47,B08KJFSHDZ,The Woods,0.99,4.2,3,https://m.media-amazon.com/images/I/91O9sCIc69L._AC_UL320_.jpg,https://www.amazon.com//Woods-Charlie-Baehner/dp/B08KJFSHDZ/ref=sr_1_47?dchild=1&keywords=wood&qid=1625202410&sr=8-47,not be a best
48,B08YYYD9BY,"101pcs Wood Burning Kit, Professional Pyrography Pen Tool, Creative wood burner Tool Set , Adjustable Temperature WoodBurner for Embossing/Carving,Suitable for Beginners,Adults,Kids",49.99,4.0,37,https://m.media-amazon.com/images/I/91JsGMsRyCL._AC_UL320_.jpg,https://www.amazon.com//Professional-Pyrography-Adjustable-Temperature-WoodBurner/dp/B08YYYD9BY/ref=sr_1_48?dchild=1&keywords=wood&qid=1625202410&sr=8-48,not be a best
49,B000035Z28,The Wood,14.99,4.8,"2,946",https://m.media-amazon.com/images/I/51ZEVCZYYAL._AC_UL320_.jpg,https://www.amazon.com//Wood-Elayn-J-Taylor/dp/B000035Z28/ref=sr_1_49?dchild=1&keywords=wood&qid=1625202410&sr=8-49,not be a best
50,B087R4CLSX,CARGEN 3 PCS Wood Seasoning Beewax Natural Beewax Traditional Wood Wax Multipurpose Beeswax Furniture Polish for Wood Polish Furniture Care,out of stock,4.3,"2,813",https://m.media-amazon.com/images/I/81x3Vd4cYJS._AC_UL320_.jpg,https://www.amazon.com//CARGEN-Seasoning-Traditional-Multipurpose-Furniture/dp/B087R4CLSX/ref=sr_1_50?dchild=1&keywords=wood&qid=1625202410&sr=8-50,not be a best
51,B08TBTQH1W,"Epoxy Resin Kit, Crystal Clear Deep Pour Epoxy Resin for River Tables, Live Edge and Wood Filler, ¾ Gallon Clear Casting Pourable Epoxy Resin(2:1 Mix Ratio)",out of stock,5.0,2,https://m.media-amazon.com/images/I/71-5TNsQLyS._AC_UL320_.jpg,https://www.amazon.com//Crystal-Tables-Filler-Casting-Pourable/dp/B08TBTQH1W/ref=sr_1_51?dchild=1&keywords=wood&qid=1625202410&sr=8-51,not be a best
52,B00FEBARJE,"Rubbermaid Reveal Spray Microfiber Floor Mop Cleaning Kit for Laminate & Hardwood Floors, Spray Mop with Reusable Washable Pads, Commercial Mop",out of stock,4.6,"6,265",https://m.media-amazon.com/images/I/51YlxXCtJCL._AC_UL320_.jpg,https://www.amazon.com//Rubbermaid-1892663-Reveal-Spray-Mop/dp/B00FEBARJE/ref=sr_1_52?dchild=1&keywords=wood&qid=1625202410&sr=8-52,not be a best
53,B08NDRRJZT,"Wood Carving Tools 12 Set Carving Knife Tools Upgrade SK7 Carbon Steel Carving Tools Wood Carving Knife Set Case for Wood, Pumpkin, Soap,Vegetables",19.99,4.5,60,https://m.media-amazon.com/images/I/71uvf-hyHdL._AC_UL320_.jpg,https://www.amazon.com//gp/slredirect/picassoRedirect.html/ref=pa_sp_btf_aps_sr_pg1_1?ie=UTF8&adId=A0059097370Z9JAQWGSZP&url=%2FCarving-Upgrade-Carbon-Pumpkin-Vegetables%2Fdp%2FB08NDRRJZT%2Fref%3Dsr_1_53_sspa%3Fdchild%3D1%26keywords%3Dwood%26qid%3D1625202410%26sr%3D8-53-spons%26psc%3D1&qualifier=1625202410&id=8428380279192587&widgetName=sp_btf,not be a best
54,B093BJ22L1,"Wood Circles for Crafts, 3 Pack 12 Inches Unfinished Rounds Wood Slices, Premium Natural Solid Wood, for Painting, Door Design, Party Decoration, Holiday Gifts and DIY Crafts",7.99,no rating,no review,https://m.media-amazon.com/images/I/71NX6g9KGlS._AC_UL320_.jpg,https://www.amazon.com//gp/slredirect/picassoRedirect.html/ref=pa_sp_btf_aps_sr_pg1_1?ie=UTF8&adId=A09048181E4CKVM1RBU4V&url=%2FPack-Wood-Circles-Crafts-Unfinished%2Fdp%2FB093BJ22L1%2Fref%3Dsr_1_54_sspa%3Fdchild%3D1%26keywords%3Dwood%26qid%3D1625202410%26sr%3D8-54-spons%26psc%3D1&qualifier=1625202410&id=8428380279192587&widgetName=sp_btf,not be a best
55,B087BZKYKJ,"60PCS Unfinished Wood Pieces, 4 x 4 Inch Squares Blank Wood Slices, for Coasters, Painting Staining, DIY Crafts, Christmas HomeDecoration",12.69,4.7,342,https://m.media-amazon.com/images/I/71IdAyOJmnS._AC_UL320_.jpg,https://www.amazon.com//gp/slredirect/picassoRedirect.html/ref=pa_sp_btf_aps_sr_pg1_1?ie=UTF8&adId=A055893738GT9W1MSAGNV&url=%2FUnfinished-Coasters-Painting-Christmas-HomeDecoration%2Fdp%2FB087BZKYKJ%2Fref%3Dsr_1_55_sspa%3Fdchild%3D1%26keywords%3Dwood%26qid%3D1625202410%26sr%3D8-55-spons%26psc%3D1&qualifier=1625202410&id=8428380279192587&widgetName=sp_btf,not be a best
56,B08H88MJRG,Ruisita Square Wood Pieces 4 Inch Unfinished Blank Squar 80 Pieces Square Wood Pieces 4 Inch Unfinished Blank Squar Wooden Cutouts with Brushes and Pigment for DIY Arts Crafts Project,15.99,4.8,31,https://m.media-amazon.com/images/I/81oY4Y0C4OL._AC_UL320_.jpg,https://www.amazon.com//gp/slredirect/picassoRedirect.html/ref=pa_sp_btf_aps_sr_pg1_1?ie=UTF8&adId=A05347364SA30BS9Y29Q&url=%2FRuisita-Unfinished-Cutouts-Brushes-Pigment%2Fdp%2FB08H88MJRG%2Fref%3Dsr_1_56_sspa%3Fdchild%3D1%26keywords%3Dwood%26qid%3D1625202410%26sr%3D8-56-spons%26psc%3D1&qualifier=1625202410&id=8428380279192587&widgetName=sp_btf,not be a best
57,B08TWQVZ18,"Wood Burning kit, SUNVIR 128 Pcs Professional Wood Burning Kit for Adults Beginners, Wood Burner Pyrography Pen with Adjustable Temperature Wood Burning Tool for Embossing/Carving/Soldering",35.99,4.2,32,https://m.media-amazon.com/images/I/81L9gU6KLrL._AC_UL320_.jpg,https://www.amazon.com//gp/slredirect/picassoRedirect.html/ref=pa_sp_btf_aps_sr_pg1_1?ie=UTF8&adId=A00895051USGE6I0A0DD9&url=%2FProfessional-Soldering-Adjustable-Temperature-Pyrography%2Fdp%2FB08TWQVZ18%2Fref%3Dsr_1_57_sspa%3Fdchild%3D1%26keywords%3Dwood%26qid%3D1625202410%26sr%3D8-57-spons%26psc%3D1&qualifier=1625202410&id=8428380279192587&widgetName=sp_btf,not be a best
58,B0925TR866,"SMJPBH Natural Unfinished LSMJPBH Natural Unfinished Large Wood Chips 3 Pieces 10 -11 Inches, Used For Art And DIY Handicraft Wood Chips, Antique Home Decoration And Cake Tray Display Name Label Round",29.99,no rating,($10.00/Count),https://m.media-amazon.com/images/I/71bKo7qIKJL._AC_UL320_.jpg,https://www.amazon.com//gp/slredirect/picassoRedirect.html/ref=pa_sp_btf_aps_sr_pg1_1?ie=UTF8&adId=A07918373BA6XTXQG86JH&url=%2FSMJPBH-Natural-Unfinished-Handicraft-Decoration%2Fdp%2FB0925TR866%2Fref%3Dsr_1_58_sspa%3Fdchild%3D1%26keywords%3Dwood%26qid%3D1625202410%26sr%3D8-58-spons%26psc%3D1&qualifier=1625202410&id=8428380279192587&widgetName=sp_btf,not be a best
