num,name,price,type,star,sold,from,img_src,url,id
135,ANGELS EYES PLUS CHICKEN FOR DOGS TEAR STAIN REMOVER ELIMINATOR ANGEL'S 45g ลดคราบน้ำตาสุนัข รสไก่,950.0,general,4.6667,15.0,จังหวัดกรุงเทพมหานคร,https://cf.shopee.co.th/file/82b902681db7dc9181f50d6453271514_tn,https://shopee.co.th//ANGELS-EYES-PLUS-CHICKEN-FOR-DOGS-TEAR-STAIN-REMOVER-ELIMINATOR-ANGEL'S-45g-ลดคราบน้ำตาสุนัข-รสไก่-i.31908061.1031045032,1031045032
136,coco omega burn 500 ml.,420.0,ร้านแนะนำ,4.925,105.0,จังหวัดกรุงเทพมหานคร,https://cf.shopee.co.th/file/497ba0ff7632efea2cf5a464d1ab807d_tn,https://shopee.co.th//coco-omega-burn-500-ml.-i.371321879.6377531867,6377531867
137,Knorr Stock Cubes Chicken 80g คนอร์ ซุปก้อนรสไก่ 80กรัม,146.0,general,5.0,9.0,จังหวัดกรุงเทพมหานคร,https://cf.shopee.co.th/file/6490d71d5cc1126b957b1f4ee247a204_tn,https://shopee.co.th//Knorr-Stock-Cubes-Chicken-80g-คนอร์-ซุปก้อนรสไก่-80กรัม-i.38135558.9930106415,9930106415
138,燒烤 麻辣粉1+2 หม่าล่า1+2,1100.0,general,5.0,1.0,จังหวัดเชียงราย,https://cf.shopee.co.th/file/c77986f3710d5146c1f134376cd25bd3_tn,https://shopee.co.th//燒烤-麻辣粉1-2-หม่าล่า1-2-i.153784019.6974072950,6974072950
139,(ชุดสุดคุ้ม ลดแรง) ไส้อั่ว น้ำหนักสุทธิ 1000 กรัม (ลูกค้าจะได้ 500 กรัม+500 กรัม),280.0,ร้านแนะนำ,4.9565,41.0,จังหวัดลำปาง,https://cf.shopee.co.th/file/f2de018b6065573420496276b0a5c0a0_tn,https://shopee.co.th//(ชุดสุดคุ้ม-ลดแรง)-ไส้อั่ว-น้ำหนักสุทธิ-1000-กรัม-(ลูกค้าจะได้-500-กรัม-500-กรัม)-i.141279352.9959919902,9959919902
140,🚩🚩ซอส ต๊อกโบกี🚩🚩 1kg-2kg .ต๊อกโบกี ต๊อก แป้งต๊อกโบกี ต๊อกบกกี ต๊อกบ๊อกกี อาหารเกาหลี,399.0,general,4.8333,395.0,จังหวัดอุดรธานี,https://cf.shopee.co.th/file/87bb3d0fc2b682f2b48588d55d894ae2_tn,https://shopee.co.th//🚩🚩ซอส-ต๊อกโบกี🚩🚩-1kg-2kg-.ต๊อกโบกี-ต๊อก-แป้งต๊อกโบกี-ต๊อกบกกี-ต๊อกบ๊อกกี-อาหารเกาหลี-i.234696780.6822362951,6822362951
141,เกลือหิมาลายัน แบบบดละเอียด ตราNIZE (เกรดพรีเมี่ยม) PINKS,119.0,shopee mall,4.8921,2300.0,จังหวัดกรุงเทพมหานคร,https://cf.shopee.co.th/file/643b8bb7f7587128117206d720207929_tn,https://shopee.co.th//เกลือหิมาลายัน-แบบบดละเอียด-ตราNIZE-(เกรดพรีเมี่ยม)-PINKS-i.39853760.3609703819,3609703819
142,Bisto Best Chicken Gravy 250g บิสโต เบส ซอสผงสำหรับทำน้ำเกรวี่ รสไก่ 250 กรัม,156.0,general,5.0,34.0,จังหวัดกรุงเทพมหานคร,https://cf.shopee.co.th/file/7be7d59b25ca92af14c85589054594f5_tn,https://shopee.co.th//Bisto-Best-Chicken-Gravy-250g-บิสโต-เบส-ซอสผงสำหรับทำน้ำเกรวี่-รสไก่-250-กรัม-i.38135558.3163169316,3163169316
143,✨ขายดี ✨น้ำจิ้มคีโต/ซอสคีโต ไร้น้ำตาล 17 รสชาติ 180 ml เสริฟ์จากครัว คีโต คาเฟ่ รสชาติจัดจ้านกลมกล่อม  by A M,76.0,ร้านแนะนำ,4.7762,11700.0,จังหวัดกรุงเทพมหานคร,https://cf.shopee.co.th/file/cdac327e3b94e374c9c0769b1fa099ab_tn,https://shopee.co.th//✨ขายดี-✨น้ำจิ้มคีโต-ซอสคีโต-ไร้น้ำตาล-17-รสชาติ-180-ml-เสริฟ์จากครัว-คีโต-คาเฟ่-รสชาติจัดจ้านกลมกล่อม-by-A-M-i.36147805.2393812787,2393812787
144,ซอส BBQ Homemade ซอสหมัก ขนาด 5 ลิตร,700.0,general,0.0,no sold,จังหวัดกรุงเทพมหานคร,https://cf.shopee.co.th/file/78d13aa1c8fb52ca2b70b07ba143f2db_tn,https://shopee.co.th//ซอส-BBQ-Homemade-ซอสหมัก-ขนาด-5-ลิตร-i.130220992.6762582858,6762582858
145,[KETO] ซอสหอยแบบแพคคู่ 2 ขวด180บาท(ขวดละ300ml),180.0,ร้านแนะนำ,4.896,325.0,จังหวัดกรุงเทพมหานคร,https://cf.shopee.co.th/file/9dd48791768b2738a1e70b47ab7515cb_tn,https://shopee.co.th//-KETO-ซอสหอยแบบแพคคู่-2-ขวด180บาท(ขวดละ300ml)-i.264895406.6663085560,6663085560
146,S4000P200 ซอสหม่าล่า + พริกหม่าล่า บิ๊กกริลล์ คอมโบ้ สำหรับ 1000 ไม้ ไม้ละ 74 สตางค์ ไม่อร่อยยินดีคืนเงิน,694.0,general,4.88,188.0,จังหวัดภูเก็ต,https://cf.shopee.co.th/file/f0aeb3977dce20207e45e2192de12385_tn,https://shopee.co.th//S4000P200-ซอสหม่าล่า-พริกหม่าล่า-บิ๊กกริลล์-คอมโบ้-สำหรับ-1000-ไม้-ไม้ละ-74-สตางค์-ไม่อร่อยยินดีคืนเงิน-i.79487729.2172406040,2172406040
147,ผงไก่โรยอาหาร Chicken Powder  Padfoot Recipe,59.0,ร้านแนะนำ,4.9265,526.0,จังหวัดกรุงเทพมหานคร,https://cf.shopee.co.th/file/f7237d08c45c4950375f3161fcddb075_tn,https://shopee.co.th//ผงไก่โรยอาหาร-Chicken-Powder-Padfoot-Recipe-i.3392809.2036601495,2036601495
148,พาลโด โวลเคโน เคอร์รี่ ชิกเก้น นูดเดิ้ล 140 กรัม แพ็ค 4 / Paldo Volcano Curry Chicken Noodle Pack 4x140 g.,138.0,shopee mall,4.88,102.0,จังหวัดกรุงเทพมหานคร,https://cf.shopee.co.th/file/186a4bc83962721b2231e11bdebfd03f_tn,https://shopee.co.th//พาลโด-โวลเคโน-เคอร์รี่-ชิกเก้น-นูดเดิ้ล-140-กรัม-แพ็ค-4-Paldo-Volcano-Curry-Chicken-Noodle-Pack-4x140-g.-i.137241569.6100440121,6100440121
149,[ดีลส่วนลด] Texas Chicken : จูเนียร์ เม็กซ์ แร๊พ 1 ชิ้น,41.0,shopee mall,0.0,6500.0,จังหวัดกรุงเทพมหานคร,https://cf.shopee.co.th/file/ada1e46ac7445498dd6e6789373b3c5e_tn,https://shopee.co.th//-ดีลส่วนลด-Texas-Chicken-จูเนียร์-เม็กซ์-แร๊พ-1-ชิ้น-i.175825579.4058084835,4058084835
150,อาหารบาร์ฟ (สุนัข) BARF. สูตรไก่ | (500g) - Chicken Formula,75.0,general,4.9206,5300.0,จังหวัดกรุงเทพมหานคร,https://cf.shopee.co.th/file/a9d8e73aa3f49ef219ac8354164162a1_tn,https://shopee.co.th//อาหารบาร์ฟ-(สุนัข)-BARF.-สูตรไก่-(500g)-Chicken-Formula-i.90380517.1501730878,1501730878
151,ชุดนอนมาสคอต ไก่ขาว chicken,442.0,general,4.3571,29.0,จังหวัดกรุงเทพมหานคร,https://cf.shopee.co.th/file/2e5bdd03988734d5df6c9d25df6f29ec_tn,https://shopee.co.th//ชุดนอนมาสคอต-ไก่ขาว-chicken-i.22574261.1020409809,1020409809
152,ขนมจีบไก่ฮาล้าล Dumpling Chicken Halal,120.0,general,5.0,6.0,จังหวัดกรุงเทพมหานคร,https://cf.shopee.co.th/file/bc92eeee2e2406d7fc218b5eed2ca546_tn,https://shopee.co.th//ขนมจีบไก่ฮาล้าล-Dumpling-Chicken-Halal-i.198188102.9912795238,9912795238
153,Hill's® Prescription Diet® k/d® Early Support Feline Chicken Dry Food 3.85 kg,1199.0,general,4.8,32.0,จังหวัดกรุงเทพมหานคร,https://cf.shopee.co.th/file/6d111b11379face1c526fd7ebe105671_tn,https://shopee.co.th//Hill's®-Prescription-Diet®-k-d®-Early-Support-Feline-Chicken-Dry-Food-3.85-kg-i.139240422.7731938910,7731938910
154,พวงกุญแจ eat chicken สําหรับติดหมวกกันน็อค,12.0,ร้านแนะนำ,4.7692,1000.0,ต่างประเทศ,https://cf.shopee.co.th/file/2281e74c3b4461add2f9dc98b2f6f990_tn,https://shopee.co.th//พวงกุญแจ-eat-chicken-สําหรับติดหมวกกันน็อค-i.76529808.1533739170,1533739170
155,"Pet8 T Stick 5"" with Yakitori Chicken Style 450g (JJA48)",189.0,ร้านแนะนำ,4.9649,458.0,จังหวัดสมุทรปราการ,https://cf.shopee.co.th/file/a1129ad4c06ef0af214b5efa3209f6dc_tn,https://shopee.co.th//Pet8-T-Stick-5-with-Yakitori-Chicken-Style-450g-(JJA48)-i.47759638.1150245235,1150245235
156,[MANOON] Instinct Raw Boost Cat Healthy Weight Chicken 4.5lb (2kg) สูตรเนื้อไก่สำหรับแมวควบคุมน้ำหนัก,1935.0,general,5.0,10.0,จังหวัดกรุงเทพมหานคร,https://cf.shopee.co.th/file/6c50a3fbe6dfb205cc28a2eebc52b44d_tn,https://shopee.co.th//-MANOON-Instinct-Raw-Boost-Cat-Healthy-Weight-Chicken-4.5lb-(2kg)-สูตรเนื้อไก่สำหรับแมวควบคุมน้ำหนัก-i.87766216.1633477172,1633477172
157,เบค่อนไก่ ฮาล้าล chicken strip แผ่นยาวมาก ขนาด 500 กรัม,176.0,general,4.875,17.0,จังหวัดกรุงเทพมหานคร,https://cf.shopee.co.th/file/b6703b2fefd8d9cf229f7b5339a54091_tn,https://shopee.co.th//เบค่อนไก่-ฮาล้าล-chicken-strip-แผ่นยาวมาก-ขนาด-500-กรัม-i.19571206.5132509789,5132509789
158,"ไก่ทอดคาราเกะชิ้นใหญ่ (Fried Chicken Karaage) 1,000 กรัม/ถุง",120.0,general,4.8,14.0,จังหวัดกรุงเทพมหานคร,https://cf.shopee.co.th/file/df4b5c5b2a164c234a9a3ac0d8d664b7_tn,https://shopee.co.th//ไก่ทอดคาราเกะชิ้นใหญ่-(Fried-Chicken-Karaage)-1-000-กรัม-ถุง-i.353827617.6078595769,6078595769
159,Fadecase Plush Toy - CSGO Chicken C4,350.0,general,5.0,5.0,จังหวัดกรุงเทพมหานคร,https://cf.shopee.co.th/file/747b88f73c379a3efab1f6474f1b02e7_tn,https://shopee.co.th//Fadecase-Plush-Toy-CSGO-Chicken-C4-i.233708032.5461261709,5461261709
160,Jinny Soft chicken slice ขนมแมว จินนี่ ไก่นิ่ม สไลด์ 30g.,25.0,ร้านแนะนำ,4.8125,90.0,จังหวัดนครราชสีมา,https://cf.shopee.co.th/file/eb3dd3166ae39f14e487890c1160a4cc_tn,https://shopee.co.th//Jinny-Soft-chicken-slice-ขนมแมว-จินนี่-ไก่นิ่ม-สไลด์-30g.-i.36479205.5324471054,5324471054
161,พร้อมส่ง 순살크리스피 ไก่ทอดเกาหลีรสดั้งเดิม CJ Boneless Crispy Chicken 550g,349.0,general,4.6667,9.0,จังหวัดชลบุรี,https://cf.shopee.co.th/file/5885b863c941830002a02ef5c20cece2_tn,https://shopee.co.th//พร้อมส่ง-순살크리스피-ไก่ทอดเกาหลีรสดั้งเดิม-CJ-Boneless-Crispy-Chicken-550g-i.34644158.8716154825,8716154825
162,[Bingo] Chicken stick Jerky ฺyummy stick Bingo star ขนมหมา ขนมสุนัข 500กรัม,65.0,general,4.8333,31.0,จังหวัดพัทลุง,https://cf.shopee.co.th/file/236026d3d970a93461d05f092fa51675_tn,https://shopee.co.th//-Bingo-Chicken-stick-Jerky-ฺyummy-stick-Bingo-star-ขนมหมา-ขนมสุนัข-500กรัม-i.62754594.3887185423,3887185423
163,[MANOON] Neez+ Cat Food Chicken Grain Free 300g นีซพลัส อาหารแมวเกรนฟรี รสไก่ 300กรัม,109.0,general,4.8667,33.0,จังหวัดกรุงเทพมหานคร,https://cf.shopee.co.th/file/ec8697c275aabdb60faa95f25e9eb9dd_tn,https://shopee.co.th//-MANOON-Neez-Cat-Food-Chicken-Grain-Free-300g-นีซพลัส-อาหารแมวเกรนฟรี-รสไก่-300กรัม-i.87766216.5015081365,5015081365
164,Hill's Science Diet Youthful Vitality Adult7+ Small&Toy Breed Chicken&Rice Recipe อาหารสุนัขอายุมากกว่า7ปี ขนาด5.67กก.,1520.0,general,4.8704,117.0,จังหวัดกรุงเทพมหานคร,https://cf.shopee.co.th/file/223acfb64d237b75be104a37bf27d6fe_tn,https://shopee.co.th//Hill's-Science-Diet-Youthful-Vitality-Adult7-Small-Toy-Breed-Chicken-Rice-Recipe-อาหารสุนัขอายุมากกว่า7ปี-ขนาด5.67กก.-i.67974726.1394312536,1394312536
165,ปีกบนไก่อบสไปซี่ (Chicken Wings Spicy) ขนาด 1 กก. (22-25 ชิ้น),140.0,ร้านแนะนำ,4.8077,122.0,จังหวัดนนทบุรี,https://cf.shopee.co.th/file/17fa18d716e8aca19ca1b39e1845b5f8_tn,https://shopee.co.th//ปีกบนไก่อบสไปซี่-(Chicken-Wings-Spicy)-ขนาด-1-กก.-(22-25-ชิ้น)-i.35173471.5145603222,5145603222
166,💚 (แพ็ค 5 ซอง) ซัมยัง มาม่า ราเมง กึ่งสำเร็จรูป มาม่าเกาหลี สูตรไก่เผ็ด หลากหลายรสชาติ Samyang Hot Chicken Flovor Ramen,195.0,ร้านแนะนำ,4.931,119.0,จังหวัดกรุงเทพมหานคร,https://cf.shopee.co.th/file/887bbe1c5eb495eb6687ba44fd827d07_tn,https://shopee.co.th//💚-(แพ็ค-5-ซอง)-ซัมยัง-มาม่า-ราเมง-กึ่งสำเร็จรูป-มาม่าเกาหลี-สูตรไก่เผ็ด-หลากหลายรสชาติ-Samyang-Hot-Chicken-Flovor-Ramen-i.2186977.5916141492,5916141492
167,"ไก่โอ๊ก ของเล่นหมา ตัวใหญ่ ใส่เสื้อบอล Squeeze dog toy, chicken toy for dog, large size, with football shirt",99.0,general,4.9,28.0,จังหวัดชลบุรี,https://cf.shopee.co.th/file/3a81a5e3765fb8451eb23752f72fc2d9_tn,https://shopee.co.th//ไก่โอ๊ก-ของเล่นหมา-ตัวใหญ่-ใส่เสื้อบอล-Squeeze-dog-toy-chicken-toy-for-dog-large-size-with-football-shirt-i.90614885.7234508576,7234508576
168,Perfecta Puppy Chicken&Brown Rice ไก่และข้าวกล้องสำหรับลูกสุนัข ขนาด 7 Kg,896.0,ร้านแนะนำ,5.0,8.0,จังหวัดกรุงเทพมหานคร,https://cf.shopee.co.th/file/5bf1b67280d64788348a56f709a5a03f_tn,https://shopee.co.th//Perfecta-Puppy-Chicken-Brown-Rice-ไก่และข้าวกล้องสำหรับลูกสุนัข-ขนาด-7-Kg-i.56717998.7238180470,7238180470
169,Hill's Science Diet Adult 1-6  Healthy Cuisine Roasted Chicken & Rice Medley 79 กรัม 1 กระป๋อง อาหารแมวอายุ 1-6 ปีขึ้นไป,42.0,ร้านแนะนำ,5.0,42.0,จังหวัดระยอง,https://cf.shopee.co.th/file/96e6ed804e14d7154c7eeb7b3c57b078_tn,https://shopee.co.th//Hill's-Science-Diet-Adult-1-6-Healthy-Cuisine-Roasted-Chicken-Rice-Medley-79-กรัม-1-กระป๋อง-อาหารแมวอายุ-1-6-ปีขึ้นไป-i.190528135.10300425390,10300425390
170,อกไก่อบแห้ง Chicken Breast Padfoot Recipe,130.0,ร้านแนะนำ,4.9524,602.0,จังหวัดกรุงเทพมหานคร,https://cf.shopee.co.th/file/0dfe6cfea5ae9b38506291a0af3af287_tn,https://shopee.co.th//อกไก่อบแห้ง-Chicken-Breast-Padfoot-Recipe-i.3392809.946429250,946429250
171,Atlas Cat Can เนื้อผสมตับไก่ในเยลลี่ 85กรัม  Beef with Chicken liver in Gravy  85g. (อาหารแมวเปียกบรรจุกระป๋อง),30.0,general,5.0,37.0,จังหวัดสมุทรปราการ,https://cf.shopee.co.th/file/6514ce7e9385e4f61ce12ff62be35524_tn,https://shopee.co.th//Atlas-Cat-Can-เนื้อผสมตับไก่ในเยลลี่-85กรัม-Beef-with-Chicken-liver-in-Gravy-85g.-(อาหารแมวเปียกบรรจุกระป๋อง)-i.312461782.5755650074,5755650074
172,ตะขอเกี่ยวเป็ด/ไก่แบบสั้น Short duck / chicken hook,170.0,general,4.5294,58.0,จังหวัดกรุงเทพมหานคร,https://cf.shopee.co.th/file/9bd2e3dc90abe62869fbd1eb66b1acd3_tn,https://shopee.co.th//ตะขอเกี่ยวเป็ด-ไก่แบบสั้น-Short-duck-chicken-hook-i.65605484.2906131763,2906131763
173,Samyang Buldak Hot Chicken Cheese Ramen Big Bowl ซัมยัง บูลดัก ฮอต ชิคเก้น ชีส ราเมง บิ๊ก โบว์ล 105 กรัม,55.0,shopee mall,4.9474,132.0,จังหวัดกรุงเทพมหานคร,https://cf.shopee.co.th/file/43677e68508f1d0d2bacc47bab8001da_tn,https://shopee.co.th//Samyang-Buldak-Hot-Chicken-Cheese-Ramen-Big-Bowl-ซัมยัง-บูลดัก-ฮอต-ชิคเก้น-ชีส-ราเมง-บิ๊ก-โบว์ล-105-กรัม-i.294954656.7447658485,7447658485
174,🌈((ห่อบั๊บเบิ้ลทุกกล่อง))‼️มาม่าเผ็ดที่สุดในโลก มาม่ามาเลเซีย Ghost Pepper Spicy Chicken,35.0,general,4.7778,150.0,จังหวัดเลย,https://cf.shopee.co.th/file/aa8a46d3dcc40e04b3e20a31cd84479b_tn,https://shopee.co.th//🌈((ห่อบั๊บเบิ้ลทุกกล่อง))‼️มาม่าเผ็ดที่สุดในโลก-มาม่ามาเลเซีย-Ghost-Pepper-Spicy-Chicken-i.3011486.9503963222,9503963222
175,[MANOON] Marvo Grilled Chicken&Vegetable 90g มาร์โว่ อาหารสุนัข เนื้อไก่ย่างและผัก,20.0,general,5.0,28.0,จังหวัดกรุงเทพมหานคร,https://cf.shopee.co.th/file/4c6cf98b2500a8bea25c96cd777f0413_tn,https://shopee.co.th//-MANOON-Marvo-Grilled-Chicken-Vegetable-90g-มาร์โว่-อาหารสุนัข-เนื้อไก่ย่างและผัก-i.87766216.2505351972,2505351972
176,jb & mini chicken fairy ตุ๊กตาเรซิ่นสําหรับติดตกแต่งผนังบ้านสวน,7.0,ร้านแนะนำ,5.0,7.0,ต่างประเทศ,https://cf.shopee.co.th/file/9bb682f7007c2d58bddbeb7b157afbda_tn,https://shopee.co.th//jb-mini-chicken-fairy-ตุ๊กตาเรซิ่นสําหรับติดตกแต่งผนังบ้านสวน-i.169901249.6602140311,6602140311
177,Dogkery Chicken Biscuit Bite บิสกิตไบท์ รสไก่,95.0,general,5.0,34.0,จังหวัดกรุงเทพมหานคร,https://cf.shopee.co.th/file/59fdcd179cc2b1d2d1a019dba1fa79c9_tn,https://shopee.co.th//Dogkery-Chicken-Biscuit-Bite-บิสกิตไบท์-รสไก่-i.120883534.4534337113,4534337113
178,หมอน&หมอนข้าง Chicken!! นุ่มเกรดโรงแรม หมอนหนุน,78.0,ร้านแนะนำ,4.7831,1300.0,จังหวัดร้อยเอ็ด,https://cf.shopee.co.th/file/672ab8acecb0d15b22d5b9f102a8e9ff_tn,https://shopee.co.th//หมอน-หมอนข้าง-Chicken!!-นุ่มเกรดโรงแรม-หมอนหนุน-i.62716634.5137342277,5137342277
179,[ส่งฟรี] สแนปปี้ทอม อาหารแมวขนาด 400 กรัม สูตรไก่ x12 กป. (Snappy Tom CAT FOOD 400 g. Chicken x12),410.0,shopee mall,5.0,80.0,จังหวัดกรุงเทพมหานคร,https://cf.shopee.co.th/file/fc519bb860aca5321e5bec3d5d2f6fe7_tn,https://shopee.co.th//-ส่งฟรี-สแนปปี้ทอม-อาหารแมวขนาด-400-กรัม-สูตรไก่-x12-กป.-(Snappy-Tom-CAT-FOOD-400-g.-Chicken-x12)-i.279462215.7242201037,7242201037
180,อาหารบาร์ฟ BARF - สูตรเริ่มต้น l 500g - Chicken Starter Formula,70.0,general,5.0,20.0,จังหวัดกรุงเทพมหานคร,https://cf.shopee.co.th/file/144bb2dc6073e4dbc50f4232dece3d0a_tn,https://shopee.co.th//อาหารบาร์ฟ-BARF-สูตรเริ่มต้น-l-500g-Chicken-Starter-Formula-i.373919653.9650130777,9650130777
181,🔥Jerhigh Stick ขนมสุนัข เจอร์ไฮ Chicken Strip ขนาด 70 g. มีครบทุกรส!🔥,33.0,ร้านแนะนำ,5.0,325.0,จังหวัดราชบุรี,https://cf.shopee.co.th/file/0e23c2a0cbc8718cda56e27ad149d572_tn,https://shopee.co.th//🔥Jerhigh-Stick-ขนมสุนัข-เจอร์ไฮ-Chicken-Strip-ขนาด-70-g.-มีครบทุกรส!🔥-i.10513230.9935131356,9935131356
182,กะปิแท้หอมอร่อย By ฮาซัน 500 กรัม 10 กระปุก,700.0,general,0.0,no sold,จังหวัดสุราษฎร์ธานี,https://cf.shopee.co.th/file/4b0a3f16c564d9c4e34eae33c8636f15_tn,https://shopee.co.th//กะปิแท้หอมอร่อย-By-ฮาซัน-500-กรัม-10-กระปุก-i.305397563.7056271921,7056271921
183,[Keto] กะปิคีโต กะปิเคยแท้ กะปิเคยโต้คลื่น ทำอาหารคีโต,75.0,ร้านแนะนำ,4.8802,1100.0,จังหวัดเชียงใหม่,https://cf.shopee.co.th/file/8ebc8c82bb5374bc9d856900658b36c7_tn,https://shopee.co.th//-Keto-กะปิคีโต-กะปิเคยแท้-กะปิเคยโต้คลื่น-ทำอาหารคีโต-i.139756243.5007940745,5007940745
184,อะมิโนมะพร้าว coconut aminos 250ml organic premium quality #มะพร้าว #อะมิโน ซีอิ๊วขาว soy sauce substitute,228.0,general,5.0,12.0,จังหวัดกรุงเทพมหานคร,https://cf.shopee.co.th/file/dd0a5ee8348704b21bc0c9d42c1eae91_tn,https://shopee.co.th//อะมิโนมะพร้าว-coconut-aminos-250ml-organic-premium-quality-มะพร้าว-อะมิโน-ซีอิ๊วขาว-soy-sauce-substitute-i.348831408.5376596429,5376596429
185,"เสือบิน : น้ำส้มสายชูหมักจากน้ำตาลมะพร้าว-แพค 3 ขวด, Suaebin : Coconut Sugar Vinegar (650 มล./ml. x3)",110.0,general,4.8,8.0,จังหวัดสมุทรปราการ,https://cf.shopee.co.th/file/8da17cb3c3c7ee3dfaa5f8c4d94190bc_tn,https://shopee.co.th//เสือบิน-น้ำส้มสายชูหมักจากน้ำตาลมะพร้าว-แพค-3-ขวด-Suaebin-Coconut-Sugar-Vinegar-(650-มล.-ml.-x3)-i.238559453.6034559675,6034559675
186,ผงหม่าล่าขนาด 1000 กรัม,690.0,general,5.0,2.0,จังหวัดสุรินทร์,https://cf.shopee.co.th/file/d19eb93e9a76a2c211a53b0eaddcc5ff_tn,https://shopee.co.th//ผงหม่าล่าขนาด-1000-กรัม-i.359020457.7269773229,7269773229
187,ปลาทูเจ​#อาหารเจ#เจ100​%#น้ำหนัก430กรัม,118.0,ร้านแนะนำ,4.9091,37.0,จังหวัดกรุงเทพมหานคร,https://cf.shopee.co.th/file/4f80d07f94aaa941a8bef9bb793d7687_tn,https://shopee.co.th//ปลาทูเจ​-อาหารเจ-เจ100​-น้ำหนัก430กรัม-i.114907779.3462432127,3462432127
