num,name,price,type,star,sold,from,img_src,url,id
280,"[EXP 09/22] Puritan's Pride Maximum Strength Triple Omega 369 Fish, Flax & Borage Oils [60 - 240 softgels] สูตรเข้มข้น",420.0,ร้านแนะนำ,4.8966,57.0,จังหวัดกรุงเทพมหานคร,https://cf.shopee.co.th/file/ec424581e0f1c84f8baf6fc4117d460d_tn,https://shopee.co.th//-EXP-09-22-Puritan's-Pride-Maximum-Strength-Triple-Omega-369-Fish-Flax-Borage-Oils-60-240-softgels-สูตรเข้มข้น-i.136769954.5427228027,5427228027
281,500G/PACK เต้าหู้ชีส (เต้าหู้ปลาไส้ชีส ชีสอัดแน่นเต็มคำ) TOFU CHEESE (FISH TOFU CHEESE FILLING),150.0,general,4.6,17.0,จังหวัดกรุงเทพมหานคร,https://cf.shopee.co.th/file/165302ba7c485ebf0fbaee1b5f15213f_tn,https://shopee.co.th//500G-PACK-เต้าหู้ชีส-(เต้าหู้ปลาไส้ชีส-ชีสอัดแน่นเต็มคำ)-TOFU-CHEESE-(FISH-TOFU-CHEESE-FILLING)-i.180403010.4668002982,4668002982
282,ขนมแมว Bok Bok Dried Fish ปลากรอบ ขนาด 50 กรัม,53.0,ร้านแนะนำ,5.0,68.0,จังหวัดสมุทรปราการ,https://cf.shopee.co.th/file/d8bcb861d4efe1f4514b32e11f263372_tn,https://shopee.co.th//ขนมแมว-Bok-Bok-Dried-Fish-ปลากรอบ-ขนาด-50-กรัม-i.93777325.5317929673,5317929673
283,[MANOON] Bok Bok Fish Sticks ขนมสุนัข สติ๊กเนื้อปลาปลา ขนาด 150g,110.0,general,5.0,33.0,จังหวัดกรุงเทพมหานคร,https://cf.shopee.co.th/file/668cd42888ab86843b10e2d12ae4b1ad_tn,https://shopee.co.th//-MANOON-Bok-Bok-Fish-Sticks-ขนมสุนัข-สติ๊กเนื้อปลาปลา-ขนาด-150g-i.87766216.2425486913,2425486913
284,Feed ring fish tank แหวนให้อาหารปลา,49.0,ร้านแนะนำ,4.8684,105.0,จังหวัดกรุงเทพมหานคร,https://cf.shopee.co.th/file/acf5ed5a37b0b3a81f8cd618b7b51f9b_tn,https://shopee.co.th//Feed-ring-fish-tank-แหวนให้อาหารปลา-i.52536112.7035844576,7035844576
285,ปลายาง Weebass รุ่น Joker Fish 3-4 นิ้ว New**2020 คละสีให้,80.0,ร้านแนะนำ,5.0,12.0,จังหวัดกาฬสินธุ์,https://cf.shopee.co.th/file/262bdd8d500a888f3bb0d728c2e4a9db_tn,https://shopee.co.th//ปลายาง-Weebass-รุ่น-Joker-Fish-3-4-นิ้ว-New**2020-คละสีให้-i.60752438.7445109184,7445109184
286,ไส้กรอกปลากาฬสินธุ์ Smoked Fish  Sausage,95.0,general,5.0,6.0,จังหวัดนนทบุรี,https://cf.shopee.co.th/file/30e74f32eeb5f61ebb7b0b00b561bfba_tn,https://shopee.co.th//ไส้กรอกปลากาฬสินธุ์-Smoked-Fish-Sausage-i.452487681.10807156388,10807156388
287,Smiling Fish น้ำแกง แกงกะหรี่ (Pour Over Sauce Yellow Curry),40.0,shopee mall,5.0,8.0,จังหวัดกรุงเทพมหานคร,https://cf.shopee.co.th/file/3b4d4c5648640d22f12da579b47e96a9_tn,https://shopee.co.th//Smiling-Fish-น้ำแกง-แกงกะหรี่-(Pour-Over-Sauce-Yellow-Curry)-i.127643526.7342129400,7342129400
288,หนังปลา หนังปลาทอดกรอบ รสไข่เค็ม ขนาด 50กรัม HongKong Salted Egg Fish Skin,69.0,ร้านแนะนำ,5.0,6.0,จังหวัดกรุงเทพมหานคร,https://cf.shopee.co.th/file/c8ae0e1cbf443b346133176c81d73125_tn,https://shopee.co.th//หนังปลา-หนังปลาทอดกรอบ-รสไข่เค็ม-ขนาด-50กรัม-HongKong-Salted-Egg-Fish-Skin-i.374951034.6188933313,6188933313
289,✹6251mm longboard big fish brush street skateboard wheels professional high elastic LDP transportation board SHR formul,1158.0,general,5.0,4.0,จังหวัดเชียงใหม่,https://cf.shopee.co.th/file/969824ff03e96c1509803af936a47dde_tn,https://shopee.co.th//✹6251mm-longboard-big-fish-brush-street-skateboard-wheels-professional-high-elastic-LDP-transportation-board-SHR-formul-i.310270928.7474853374,7474853374
290,Blackmores Fish oil 1000 mg. (80เม็ด) .exp.03/2023,390.0,general,4.878,70.0,จังหวัดกรุงเทพมหานคร,https://cf.shopee.co.th/file/e85875dc609e2e36bf5020e017f9a393_tn,https://shopee.co.th//Blackmores-Fish-oil-1000-mg.-(80เม็ด)-.exp.03-2023-i.4819247.35738285,35738285
291,Mega we care  Fish oil 1000mg  ขวด 30 แค็ปซุล 83068,99.0,ร้านแนะนำ,5.0,21.0,จังหวัดนครสวรรค์,https://cf.shopee.co.th/file/241aeb78c48fbcd31b3c9364e72ecd5b_tn,https://shopee.co.th//Mega-we-care-Fish-oil-1000mg-ขวด-30-แค็ปซุล-83068-i.140758906.7830170524,7830170524
292,"พร้อมส่งจร้าาา""IRVINS Salted Egg Fish Skin"" หนังปลาแซลมอนทอดกรอบคลุกไข่เค็ม อร่อยจนต้องร้องขอ",560.0,general,5.0,70.0,จังหวัดกรุงเทพมหานคร,https://cf.shopee.co.th/file/d502fb56175a99c1e93e22313208c9e2_tn,https://shopee.co.th//พร้อมส่งจร้าาา-IRVINS-Salted-Egg-Fish-Skin-หนังปลาแซลมอนทอดกรอบคลุกไข่เค็ม-อร่อยจนต้องร้องขอ-i.52673545.1606699896,1606699896
293,Fish Oil 1200mg Plus Vitamin E โอเมก้า3 ขนาดสูง ให้อีพีเอ 500mg:ดีเอชเอ 300mg 45 เม็ด,180.0,general,4.8,9.0,จังหวัดสุราษฎร์ธานี,https://cf.shopee.co.th/file/882ee2c5ac45fdafd0c0483094350410_tn,https://shopee.co.th//Fish-Oil-1200mg-Plus-Vitamin-E-โอเมก้า3-ขนาดสูง-ให้อีพีเอ-500mg-ดีเอชเอ-300mg-45-เม็ด-i.27900434.4660566560,4660566560
294,Stainless Steel Fish Turner Wide Spatulas Beveled Cooking,188.0,general,0.0,30.0,ต่างประเทศ,https://cf.shopee.co.th/file/386ce9ad914416aaf242e37ae8356b26_tn,https://shopee.co.th//Stainless-Steel-Fish-Turner-Wide-Spatulas-Beveled-Cooking-i.264169450.5536207987,5536207987
295,(ยกโหล 12ซอง) คิงฟิช King Fish Mini Tropical Fish สีน้ำเงิน  สำหรับปลาสอด ปลาหางนกยูง ปลาสวยงามขนาดเล็ก แบบเกล็ด,440.0,ร้านแนะนำ,4.8846,115.0,จังหวัดกรุงเทพมหานคร,https://cf.shopee.co.th/file/8d71d45b439ec6d7c37a57bf13d3eb6d_tn,https://shopee.co.th//(ยกโหล-12ซอง)-คิงฟิช-King-Fish-Mini-Tropical-Fish-สีน้ำเงิน-สำหรับปลาสอด-ปลาหางนกยูง-ปลาสวยงามขนาดเล็ก-แบบเกล็ด-i.13512869.4724346676,4724346676
296,【∮】 10pcs Crystal Fish Wire Elastic Stretch Elastic Beading Cord String Thread DIY ☆HOT☆,41.0,general,0.0,229.0,ต่างประเทศ,https://cf.shopee.co.th/file/1878f00a0b96d75aea8ee3765d6ab7e7_tn,https://shopee.co.th//【∮】-10pcs-Crystal-Fish-Wire-Elastic-Stretch-Elastic-Beading-Cord-String-Thread-DIY-☆HOT☆-i.116458728.2075610040,2075610040
297,Vistra Fish Oil 75 เม็ด จำนวน 1 ขวด,176.0,general,4.875,38.0,จังหวัดชลบุรี,https://cf.shopee.co.th/file/24071a823990d84ea678eb8f7cea5466_tn,https://shopee.co.th//Vistra-Fish-Oil-75-เม็ด-จำนวน-1-ขวด-i.65114166.7246383671,7246383671
298,MCT PLUS /MCT oil plus fish oil and lecitin 90 capsules,950.0,ร้านแนะนำ,4.9,27.0,จังหวัดสระบุรี,https://cf.shopee.co.th/file/5703fa81ec83365b7b64aeaa37f1592b_tn,https://shopee.co.th//MCT-PLUS-MCT-oil-plus-fish-oil-and-lecitin-90-capsules-i.12403074.4265672696,4265672696
299,ปลาเค็มหยอง Salted Dried Shredded Fish,100.0,general,4.5,10.0,จังหวัดระนอง,https://cf.shopee.co.th/file/042a809d6722592cbe7e1b7bdf1fc65e_tn,https://shopee.co.th//ปลาเค็มหยอง-Salted-Dried-Shredded-Fish-i.272792424.6437397366,6437397366
300,🐟 ที่ขอดเกล็ดปลา (Fish Scaler) 🐟,400.0,general,5.0,30.0,จังหวัดกรุงเทพมหานคร,https://cf.shopee.co.th/file/d4c2609ef2e3646c901f57a175d7f4a0_tn,https://shopee.co.th//🐟-ที่ขอดเกล็ดปลา-(Fish-Scaler)-🐟-i.308022917.6551791673,6551791673
1,ซุปไก่เกาหลีปรุงสำเร็จรูป original dongwon yangban chicken soup 460g,99.0,ร้านแนะนำ,4.75,7.0,จังหวัดกรุงเทพมหานคร,https://cf.shopee.co.th/file/177c74b3453a3337106b3d81dc7ba1c0_tn,https://shopee.co.th//ซุปไก่เกาหลีปรุงสำเร็จรูป-original-dongwon-yangban-chicken-soup-460g-i.211550487.11703088274,11703088274
2,iLiKE : Chicken Chip อกไก่อบกรอบ เนื้อไก่ล้วน 100% (โปร 10 แถม 2),390.0,general,4.8182,111.0,จังหวัดกรุงเทพมหานคร,https://cf.shopee.co.th/file/11f38bb0698639b26ebf3b45dbab8abc_tn,https://shopee.co.th//iLiKE-Chicken-Chip-อกไก่อบกรอบ-เนื้อไก่ล้วน-100-(โปร-10-แถม-2)-i.50101587.4145682778,4145682778
3,เปปเปอร์ ชิกเก้น - Pepper Chicken,140.0,general,4.9574,343.0,จังหวัดกรุงเทพมหานคร,https://cf.shopee.co.th/file/e74313296736421d50996c174baac2fd_tn,https://shopee.co.th//เปปเปอร์-ชิกเก้น-Pepper-Chicken-i.239829500.7623981880,7623981880
4,กลิ่นผสมอาหารเข้มข้นชนิดผง Sweet Creations สำหรับผสมในเบเกอรี่ ขนาด 100G.,160.0,ร้านแนะนำ,4.7308,97.0,จังหวัดนนทบุรี,https://cf.shopee.co.th/file/e08594a5ed3e8cc950e045628cad6734_tn,https://shopee.co.th//กลิ่นผสมอาหารเข้มข้นชนิดผง-Sweet-Creations-สำหรับผสมในเบเกอรี่-ขนาด-100G.-i.286077136.7969839875,7969839875
5,อาหารบาร์ฟ - BARF สูตรไก่ล้วนแบบเริ่มต้น l 500g - (Starter) FREE-RUN CHICKEN,65.0,general,5.0,568.0,จังหวัดกรุงเทพมหานคร,https://cf.shopee.co.th/file/a9063877603d33c8ae52120920724b9e_tn,https://shopee.co.th//อาหารบาร์ฟ-BARF-สูตรไก่ล้วนแบบเริ่มต้น-l-500g-(Starter)-FREE-RUN-CHICKEN-i.131403598.5771372396,5771372396
6,BOONE Chicken Stock Himmed Plus ซุปไก่ ฮิมเมด พลัส 30 เม็ด วิตามินบำรุงร่างกาย  83914,150.0,ร้านแนะนำ,5.0,18.0,จังหวัดนครสวรรค์,https://cf.shopee.co.th/file/5533be812fca65987f29d0676ac9ac03_tn,https://shopee.co.th//BOONE-Chicken-Stock-Himmed-Plus-ซุปไก่-ฮิมเมด-พลัส-30-เม็ด-วิตามินบำรุงร่างกาย-83914-i.140758906.9935448957,9935448957
7,ล็อตใหม่ หมดอายุปีหน้า!! Samyang Buldak Hot Chicken Sauce ซัมยัง ซอสไก่เผ็ด ซอสเกาหลี ซอสเผ็ดเกาหลี ซอสพริกไก่เผ็ดเกาหลี,125.0,ร้านแนะนำ,4.8776,8000.0,จังหวัดสมุทรปราการ,https://cf.shopee.co.th/file/c0c26355ea030086c8132b68759f24b4_tn,https://shopee.co.th//ล็อตใหม่-หมดอายุปีหน้า!!-Samyang-Buldak-Hot-Chicken-Sauce-ซัมยัง-ซอสไก่เผ็ด-ซอสเกาหลี-ซอสเผ็ดเกาหลี-ซอสพริกไก่เผ็ดเกาหลี-i.37433026.4938445193,4938445193
8,1KG/PACK ชิ้นส่วนเนื้อไก่ออร์แกนิค เกรดพรีเมียม PREMIUM ORGANIC CHICKEN FILLET,75.0,general,4.9565,152.0,จังหวัดกรุงเทพมหานคร,https://cf.shopee.co.th/file/d6541d8eeea8ad2e4b6765e884bf17b4_tn,https://shopee.co.th//1KG-PACK-ชิ้นส่วนเนื้อไก่ออร์แกนิค-เกรดพรีเมียม-PREMIUM-ORGANIC-CHICKEN-FILLET-i.180403010.6671444247,6671444247
9,Shan Butter Chicken 50 gms.,38.0,ร้านแนะนำ,5.0,15.0,จังหวัดกรุงเทพมหานคร,https://cf.shopee.co.th/file/b77947e12f7d6a63fe2c31b391534119_tn,https://shopee.co.th//Shan-Butter-Chicken-50-gms.-i.241383702.10702698581,10702698581
10,chicken shop2020[ขายดี] เสื้อแฟชั่นผู้หญิง แขนสั้น สไตล์เกาหลี สวมใส่สบาย [พร้อมส่ง][เก็บเงินปลายทาง] รุ่น A-104,79.0,general,4.6667,30.0,จังหวัดกรุงเทพมหานคร,https://cf.shopee.co.th/file/5151e157df5df855f29c3e2f2a100e38_tn,https://shopee.co.th//chicken-shop2020-ขายดี-เสื้อแฟชั่นผู้หญิง-แขนสั้น-สไตล์เกาหลี-สวมใส่สบาย-พร้อมส่ง-เก็บเงินปลายทาง-รุ่น-A-104-i.139536922.3939474544,3939474544
11,ซื้อ 1 แถม 1 VITALIFE CHICKEN TENDER สันในไก่อบแห้ง เกรดพรีเมี่ยม ขนาด 227 กรัม,168.0,ร้านแนะนำ,4.95,186.0,จังหวัดกรุงเทพมหานคร,https://cf.shopee.co.th/file/81d6a6be38fbbdb20ef9abd90aad62ba_tn,https://shopee.co.th//ซื้อ-1-แถม-1-VITALIFE-CHICKEN-TENDER-สันในไก่อบแห้ง-เกรดพรีเมี่ยม-ขนาด-227-กรัม-i.369297500.9245836133,9245836133
12,อาหารแมว NEEZ+ Chicken Grain Free อาหารแมวเกรด Holistic ขนาด 300 กรัม [Neezถุงเล็ก],109.0,ร้านแนะนำ,4.9459,88.0,จังหวัดนนทบุรี,https://cf.shopee.co.th/file/1e202a7d06dcb81441c407e193b2f769_tn,https://shopee.co.th//อาหารแมว-NEEZ-Chicken-Grain-Free-อาหารแมวเกรด-Holistic-ขนาด-300-กรัม-Neezถุงเล็ก--i.50654.5537243881,5537243881
13,อาหารเปียกแมวระดับพรีเมี่ยม 6 ดาว Feline Natural Chicken & Lamb Feast Grain-Free ขนาด 85 กรัม,195.0,ร้านแนะนำ,5.0,48.0,จังหวัดกรุงเทพมหานคร,https://cf.shopee.co.th/file/13a0f1a1e43ef1973e1c5b4f3d9f1ac0_tn,https://shopee.co.th//อาหารเปียกแมวระดับพรีเมี่ยม-6-ดาว-Feline-Natural-Chicken-Lamb-Feast-Grain-Free-ขนาด-85-กรัม-i.8384347.1361996239,1361996239
14,ซุปไก่เกาหลีปรุงสำเร็จรูป original dongwon yangban chicken soup 460g,99.0,ร้านแนะนำ,4.75,7.0,จังหวัดกรุงเทพมหานคร,https://cf.shopee.co.th/file/177c74b3453a3337106b3d81dc7ba1c0_tn,https://shopee.co.th//ซุปไก่เกาหลีปรุงสำเร็จรูป-original-dongwon-yangban-chicken-soup-460g-i.211550487.11703088274,11703088274
15,Maggi Chicken Stock 20g x 24 cube ++ แม็กกี้ สต็อกไก่ ขนาด 20g x 24 ก้อน,260.0,general,5.0,42.0,จังหวัดกรุงเทพมหานคร,https://cf.shopee.co.th/file/df8477f35412d92af7c4d8398db90a10_tn,https://shopee.co.th//Maggi-Chicken-Stock-20g-x-24-cube-แม็กกี้-สต็อกไก่-ขนาด-20g-x-24-ก้อน-i.238807015.6822350328,6822350328
16,ไก่หยอง (ซัลมา) 1 กิโลกรัม  Shredded chicken,171.0,ร้านแนะนำ,4.8524,828.0,จังหวัดนครปฐม,https://cf.shopee.co.th/file/4a55ab5e881ff3fd65339b6b7c0ece4f_tn,https://shopee.co.th//ไก่หยอง-(ซัลมา)-1-กิโลกรัม-Shredded-chicken-i.46696893.2794243517,2794243517
17,Jerhigh ขนมสุนัขสันในไก่อบแห้ง chicken jerky 200 กรัม,135.0,ร้านแนะนำ,4.913,296.0,จังหวัดกรุงเทพมหานคร,https://cf.shopee.co.th/file/cf105c713f16560f31d406a1ecc3c7a4_tn,https://shopee.co.th//Jerhigh-ขนมสุนัขสันในไก่อบแห้ง-chicken-jerky-200-กรัม-i.298276641.6348389782,6348389782
18,Mdh Butter Chicken 100g.,60.0,general,3.5,6.0,จังหวัดกรุงเทพมหานคร,https://cf.shopee.co.th/file/925f3f48971c07e8e6c8f3d584b3aab3_tn,https://shopee.co.th//Mdh-Butter-Chicken-100g.-i.157161072.10603962417,10603962417
19,Texas Chicken กะเพราแร็พ [ShopeePay] ส่วนลด ฿36,0.01,shopee mall,0.0,3200.0,จังหวัดกรุงเทพมหานคร,https://cf.shopee.co.th/file/6d7f00570a460b21978ec705d80add9c_tn,https://shopee.co.th//Texas-Chicken-กะเพราแร็พ-ShopeePay-ส่วนลด-฿36-i.175825579.8262299851,8262299851
20,Perfecta Puppy Chicken&Brown Rice ไก่และข้าวกล้องสำหรับลูกสุนัข ขนาด 1Kg,162.0,ร้านแนะนำ,4.9029,321.0,จังหวัดกรุงเทพมหานคร,https://cf.shopee.co.th/file/5bf1b67280d64788348a56f709a5a03f_tn,https://shopee.co.th//Perfecta-Puppy-Chicken-Brown-Rice-ไก่และข้าวกล้องสำหรับลูกสุนัข-ขนาด-1Kg-i.56717998.3738277543,3738277543
21,ล็อตเต้ สไปซี่ ชิคเค่น อัลมอนด์ 200 กรัม / Spicy Chicken Almond  200g,99.0,shopee mall,4.9375,58.0,จังหวัดกรุงเทพมหานคร,https://cf.shopee.co.th/file/400d109602ff4bd9395a21f7ba691a99_tn,https://shopee.co.th//ล็อตเต้-สไปซี่-ชิคเค่น-อัลมอนด์-200-กรัม-Spicy-Chicken-Almond-200g-i.137241569.3957268564,3957268564
22,Hill's k/d® Feline with Chickenอาหารกระป๋องโรคไตแมว 156กรัม,80.0,ร้านแนะนำ,4.9032,581.0,จังหวัดราชบุรี,https://cf.shopee.co.th/file/65b0846f1cc1ab9ac1ac7f8f5dea625f_tn,https://shopee.co.th//Hill's-k-d®-Feline-with-Chickenอาหารกระป๋องโรคไตแมว-156กรัม-i.123044196.7187688270,7187688270
23,Hill's®  c/d® Multicare Feline with Chicken อาหารเม็ดสำหรับแมวเป็นนิ่ว 1.5kg,645.0,ร้านแนะนำ,4.9524,38.0,จังหวัดราชบุรี,https://cf.shopee.co.th/file/8ab1a60a3e777a091a4d3ea7deb1bb4c_tn,https://shopee.co.th//Hill's®-c-d®-Multicare-Feline-with-Chicken-อาหารเม็ดสำหรับแมวเป็นนิ่ว-1.5kg-i.123044196.6987216299,6987216299
24,ซื้อ 1 แถม 1 VITALIFE Chicken Chips  สันในไก่ชิ้นอบแห้งอขนาด 227 กรัม,168.0,ร้านแนะนำ,4.9831,192.0,จังหวัดกรุงเทพมหานคร,https://cf.shopee.co.th/file/a490c1730c1526cfab70bf8638a1b5bf_tn,https://shopee.co.th//ซื้อ-1-แถม-1-VITALIFE-Chicken-Chips-สันในไก่ชิ้นอบแห้งอขนาด-227-กรัม-i.369297500.8347111736,8347111736
25,"นักเก็ตไก่แมค (Chicken Nuggets) รสชาติออริจินัล/พริกสด/ชีส 1,000กรัม/ถุง",130.0,general,4.9221,200.0,จังหวัดกรุงเทพมหานคร,https://cf.shopee.co.th/file/0876d27c5af021e5ffdde421e0f81f45_tn,https://shopee.co.th//นักเก็ตไก่แมค-(Chicken-Nuggets)-รสชาติออริจินัล-พริกสด-ชีส-1-000กรัม-ถุง-i.353827617.6574536224,6574536224
26,ขนมอกไก่อบกรอบโปรตีนสูง คลีนกินดี คีโตกินได้ chicken chips,57.0,ร้านแนะนำ,4.625,90.0,จังหวัดกรุงเทพมหานคร,https://cf.shopee.co.th/file/ac28ced57b3179be8f7d21dc30610065_tn,https://shopee.co.th//ขนมอกไก่อบกรอบโปรตีนสูง-คลีนกินดี-คีโตกินได้-chicken-chips-i.219027431.5445090027,5445090027
27,iLiKE : Chicken Chip อกไก่อบกรอบ เนื้อไก่ล้วน 100% (โปร 5 แถม 1),195.0,general,4.8273,260.0,จังหวัดกรุงเทพมหานคร,https://cf.shopee.co.th/file/14ad64960d24fab6d37553ce44bd4df7_tn,https://shopee.co.th//iLiKE-Chicken-Chip-อกไก่อบกรอบ-เนื้อไก่ล้วน-100-(โปร-5-แถม-1)-i.50101587.5745675392,5745675392
28,ซื้อ 1 แถม 1 VITALIFE CHICKEN TENDER สันในไก่อบแห้ง เกรดพรีเมี่ยม ขนาด 400 กรัม,296.0,ร้านแนะนำ,4.9561,472.0,จังหวัดกรุงเทพมหานคร,https://cf.shopee.co.th/file/587e29e57661e0ae9475ca9497b70909_tn,https://shopee.co.th//ซื้อ-1-แถม-1-VITALIFE-CHICKEN-TENDER-สันในไก่อบแห้ง-เกรดพรีเมี่ยม-ขนาด-400-กรัม-i.369297500.9445840170,9445840170
29,Nylabone Puppy Ring Bone Chicken ไนลาโบน กระดูกวงแหวน ลูกสุนัข รสไก่,190.0,shopee mall,4.8293,92.0,จังหวัดกรุงเทพมหานคร,https://cf.shopee.co.th/file/941e0e909e9611cc9fe139356bec24ee_tn,https://shopee.co.th//Nylabone-Puppy-Ring-Bone-Chicken-ไนลาโบน-กระดูกวงแหวน-ลูกสุนัข-รสไก่-i.131655051.1997722547,1997722547
30,"ซันแวลเล่ย์ ปีกไก่กรอบรสดั้งเดิม SUN VALLEY CRISPY CHICKEN WING ORI 1 KG.พื้นที่จัดส่งกทม,สมุทรปราการ,นนทบุรี,ปทุมธานี",239.0,shopee mall,5.0,3.0,จังหวัดสระบุรี,https://cf.shopee.co.th/file/c8c111a01100cc6deb0698af5fcfb500_tn,https://shopee.co.th//ซันแวลเล่ย์-ปีกไก่กรอบรสดั้งเดิม-SUN-VALLEY-CRISPY-CHICKEN-WING-ORI-1-KG.พื้นที่จัดส่งกทม-สมุทรปราการ-นนทบุรี-ปทุมธานี-i.318656571.5188749901,5188749901
31,BARFlicious บาร์ฟแมวสมดุลสูตรไก่ CHICKEN DELICIOUS ขนาด 500 กรัม,90.0,general,4.9722,655.0,จังหวัดนนทบุรี,https://cf.shopee.co.th/file/3d26ac27ee088956303c57b8b2c52f9d_tn,https://shopee.co.th//BARFlicious-บาร์ฟแมวสมดุลสูตรไก่-CHICKEN-DELICIOUS-ขนาด-500-กรัม-i.278463459.6162487238,6162487238
32,(MNIKS) Hill's 7055 Science Diet Can Adult 7+Chicken&Barley อาหารเปียกสุนัข 7ปีขึ้นไป 369g(13oz),88.0,ร้านแนะนำ,5.0,16.0,จังหวัดนนทบุรี,https://cf.shopee.co.th/file/d495ed0c26bdfd9fd9cd7d34b560f254_tn,https://shopee.co.th//(MNIKS)-Hill's-7055-Science-Diet-Can-Adult-7-Chicken-Barley-อาหารเปียกสุนัข-7ปีขึ้นไป-369g(13oz)-i.177947633.9964386866,9964386866
33,Nissin Chicken Ramen Mini มาม่าเด็กมินิ รสราเมนไก่ ไม่มีผงชูรส,89.0,ร้านแนะนำ,4.8727,445.0,จังหวัดกรุงเทพมหานคร,https://cf.shopee.co.th/file/70ed73ad4b1151f6532aa339db594007_tn,https://shopee.co.th//Nissin-Chicken-Ramen-Mini-มาม่าเด็กมินิ-รสราเมนไก่-ไม่มีผงชูรส-i.43533113.4431590038,4431590038
34,Nylabone Moderate ChewFlexichew Bone - Chicken ไนลาโบน กระดูกสำหรับแทะ เฟลกซิชูว์ รสไก่ สุนัขแทะนุ่มนวล,190.0,shopee mall,4.9524,91.0,จังหวัดกรุงเทพมหานคร,https://cf.shopee.co.th/file/278f5afbe5cdf9bd7342dc766b40a6d4_tn,https://shopee.co.th//Nylabone-Moderate-ChewFlexichew-Bone-Chicken-ไนลาโบน-กระดูกสำหรับแทะ-เฟลกซิชูว์-รสไก่-สุนัขแทะนุ่มนวล-i.131655051.1997722549,1997722549
